NAME,AUTHOR,LINK,T/F,UPVOTES,DATE-TIME
Apparently I spend too much time washing my hands.,Irrisory,https://i.redd.it/5koyzjoz0oo41.jpg ,F,0,2020-03-24 22:40:48
Todd is not doing well in quarantine,papag00s,https://i.redd.it/lggmag5y0oo41.jpg ,F,0,2020-03-24 22:40:31
"Sweet girl showed up at our barn a few years ago, terrified of people. Now she’s a cuddle machine!",morgieporgie85,https://i.redd.it/1bqpockxzno41.jpg ,F,0,2020-03-24 22:34:49
My sister's guinea pig got stuck in my sleeve and we had to bribe him out.,Cute_elbownoodle,https://i.redd.it/5baku4iuzno41.jpg ,F,0,2020-03-24 22:34:25
Mr. Fred is taking to quarantine just fine.,fredandlunchbox,https://i.redd.it/ah2okpfszno41.jpg ,F,0,2020-03-24 22:34:13
The stand off.,MrsWilliams,https://i.redd.it/aovjj9atzno41.jpg ,F,0,2020-03-24 22:34:09
She is sleeping on my jacket.,JackTheJaguar,https://i.redd.it/g28g3dfpzno41.jpg ,F,0,2020-03-24 22:33:49
Poor Floof,kanyeschild2,https://i.redd.it/berg5n9qjko41.jpg ,F,0,2020-03-24 22:33:30
The magestic stray my dad feeds outside his house.,PolymerPussies,https://i.redd.it/y647dv5kzno41.jpg ,F,0,2020-03-24 22:32:48
Just a cute lil birb,RykerDangerous02,https://i.redd.it/do0a0qeezno41.jpg ,F,0,2020-03-24 22:31:52
"Loki just wants to hang out with me in the office. But as is his namesake, he must not be allowed to enter! (He is mischievous)",grim1929,https://i.redd.it/y7i3zotczno41.jpg ,F,0,2020-03-24 22:31:37
"Why are you still home today, mom?",CalLil6,https://i.redd.it/8g2iw8b8zno41.jpg ,F,0,2020-03-24 22:31:18
Is it just my cat that does this?,digipigu,https://i.redd.it/d5lqkfd5zno41.jpg ,F,0,2020-03-24 22:30:26
"""Hello there!""",ehersomeh,https://i.redd.it/p58731h4zno41.jpg ,F,0,2020-03-24 22:30:17
Using my fat preggo belly as a bed,Octoux,https://i.redd.it/14m9ve6qyno41.jpg ,F,0,2020-03-24 22:28:10
Can I offer you a sweet sleeping puppy pic in these trying times?,bobbybox,https://i.redd.it/fkp60pfoyno41.jpg ,F,0,2020-03-24 22:27:54
help I can't get up,CallMeCalicoYT,https://i.redd.it/rxgfzekoyno41.jpg ,F,0,2020-03-24 22:27:51
Just a not so great pic of my dog.,Jim-Milton-759753,https://i.redd.it/vhn0itjjyno41.jpg ,F,0,2020-03-24 22:27:12
I told them to social distance and they complied. Good boys.,momtobe908,https://i.redd.it/otnez3m3yno41.jpg ,F,0,2020-03-24 22:24:33
Smile,CursedSk1y,https://i.redd.it/lnfdotxnxno41.jpg ,F,0,2020-03-24 22:22:21
He decided to nap in the bathtub and no one noticed him til my dad had to pee,xbrixe,https://i.redd.it/emx2ir5kxno41.jpg ,F,0,2020-03-24 22:21:33
Day 357621 of quarantine. I built a small photostudio for my special boy Yohji.,spicykimchisoup,https://i.redd.it/k143be0dxno41.jpg ,F,0,2020-03-24 22:20:26
"A love so pure, big sister with her new baby brother",Ldub_elch,https://i.redd.it/bw2hpfebxno41.jpg ,F,0,2020-03-24 22:20:10
Kitten on the Sofa,easyinterio,https://i.redd.it/bxqods48xno41.jpg ,F,0,2020-03-24 22:20:04
My dog chillin on her rug,Cooliojoseph,https://i.redd.it/ruog4adaxno41.jpg ,F,0,2020-03-24 22:20:01
"I took my dog for a W-A-L-K today. After a hour of running in the park, he decided it was time for a nap. I found him sleeping behind the ottoman.",supremeevilhedgehog,https://i.redd.it/b5pmhl98xno41.jpg ,F,0,2020-03-24 22:19:46
The joys of self isolation,antioxidantal,https://i.redd.it/xfq46mn6xno41.jpg ,F,0,2020-03-24 22:19:27
Close up of chubby squirrel,RedCoat_xx_A,https://i.redd.it/ops9wbh2xno41.jpg ,F,0,2020-03-24 22:18:52
My dumb dog and her dumb teeth,notarobotnotarobot12,https://i.redd.it/j7sarfdywno41.jpg ,F,0,2020-03-24 22:18:08
Meet Juno! My new Jeep dog!,gibbagibgib,https://i.redd.it/03iuux3ywno41.jpg ,F,0,2020-03-24 22:18:08
kitten have to ask you for something,antibioteka,https://i.redd.it/a76xi8sqjno41.jpg ,F,0,2020-03-24 22:18:01
Ball time,katalia0826,https://i.redd.it/34ta98cuwno41.jpg ,F,0,2020-03-24 22:17:31
A picture I took a while back of a squirrel on my college campus,astresoft,https://i.redd.it/ul1i6z0iwno41.jpg ,F,0,2020-03-24 22:15:40
"This stray beauty's name is Spring. She has a habit of jumping on me and hugging me whenever I step outside of my house. I managed to take a picture just before she jumped on me again. I've never seen a stray cat that loved hugging as much as her before, and I'm thinking of adopting her.",Cetot,https://i.redd.it/awi11tv1wno41.jpg ,F,0,2020-03-24 22:15:09
Puppy Blep,LOUDNOIS3S,https://i.redd.it/ht1v3a91wno41.jpg ,F,0,2020-03-24 22:13:35
"My dad's dog had her puppies today! 7 so far, and she's still going.",lucky__duck,https://i.redd.it/nvx0fp15wno41.jpg ,F,0,2020-03-24 22:13:34
A Labrador-retriever pup sleeps near his mother.,Freefight,https://i.redd.it/a0ihv1uzvno41.jpg ,F,0,2020-03-24 22:12:52
This 4 week old seal point Birman baby,loveisokay,https://i.redd.it/ixneg5bzvno41.jpg ,F,0,2020-03-24 22:12:42
This is Rusty. Rusty likes laundry baskets.,Hypry,https://i.redd.it/r4lhie3yvno41.jpg ,F,0,2020-03-24 22:12:38
Just moved back to live with my parents (temporarily) after a decade out of state and all I can ask is how did my puppy get so old?,somegamingguy,https://i.redd.it/4ewi97uwvno41.jpg ,F,0,2020-03-24 22:12:19
This is a cute cat I found named Ikiru,This_username_worked,https://i.redd.it/zvv5f5wovno41.png ,F,0,2020-03-24 22:11:03
"Just discovered my all black fur baby has one short, white, kinky whisker. (she has allergies, pardon her boogers haha)",foodisprettyneato,https://i.redd.it/cb2505gfvno41.jpg ,F,0,2020-03-24 22:09:37
Cuddle time with my little Nugget,I_Love_Foxes420,https://i.redd.it/jjre5y7bvno41.jpg ,F,0,2020-03-24 22:09:11
Hello there,Hoosier61,https://i.redd.it/bcrr42bcvno41.jpg ,F,0,2020-03-24 22:09:06
Cute doggo on the stairs,freshest_chode,https://i.redd.it/3hsupes9vno41.jpg ,F,0,2020-03-24 22:08:46
I'm gonna make him an offer he can't refuse,sseinish,https://i.redd.it/cit61v2runo41.jpg ,F,0,2020-03-24 22:07:01
"They disappeared for a while, and I found them like this. It might be time to buy a bigger bed.",catnation,https://i.redd.it/y81h7gyruno41.jpg ,F,0,2020-03-24 22:06:01
enjoy the nice breeze,0ff-Black,https://i.redd.it/zur1bv8puno41.jpg ,F,0,2020-03-24 22:05:32
Una is happy we vacuumed her favorite rug,emme2844,https://i.redd.it/tun4rh0luno41.jpg ,F,0,2020-03-24 22:04:52
GGGut,greatlordofcinder,https://i.redd.it/avuvv6vcuno41.jpg ,F,0,2020-03-24 22:03:47
She absolutely loves my fluffy nasa pants,NootTheSnoot,https://i.redd.it/c2ycuxtcuno41.jpg ,F,0,2020-03-24 22:03:35
Say hi to Archie,4ysgggvanw,https://i.redd.it/9odwzlw4uno41.jpg ,F,0,2020-03-24 22:02:20
"Simba comforting his little brother, Prince, after he got shot and has to wear a onesie to recover. He's letting his little brother be the Big Spoon <3",deakers,https://i.redd.it/7w187hcytno41.jpg ,F,0,2020-03-24 22:01:25
The family cat is really just my dad's cat: pt. 2,lajollahc,https://i.redd.it/49xwr3bntno41.jpg ,F,0,2020-03-24 21:59:35
Isolating isn't so bad when you've got a friend to keep you company,cakeiam,https://i.redd.it/skkfbxgmtno41.jpg ,F,0,2020-03-24 21:59:32
He’s very fluffy,sub_to-pew-die_pie,https://i.redd.it/w8cu3xpltno41.jpg ,F,0,2020-03-24 21:59:25
Little puppy,sweedev,https://i.redd.it/s1e13uhetno41.jpg ,F,0,2020-03-24 21:58:13
My cat stopping by to say hi!,Haloxipi,https://i.redd.it/uwe2hji9tno41.jpg ,F,0,2020-03-24 21:57:27
The way he’s sitting though,catz1000,https://i.redd.it/o9kutoa3tno41.jpg ,F,0,2020-03-24 21:56:34
Not getting much work done during quarentine,lazarmarlin,https://i.redd.it/dc8hcjr2tno41.jpg ,F,0,2020-03-24 21:56:24
Cold hard chillin',Iman3477,https://i.redd.it/ytjj4ia1tno41.jpg ,F,0,2020-03-24 21:56:12
The Fluff Queen on her Comfy Throne,Old_Man_Robot,https://i.redd.it/hrrx7sczsno41.jpg ,F,0,2020-03-24 21:55:54
Oreo and Smokey,heckbeast,https://i.redd.it/idrz5x0tsno41.jpg ,F,0,2020-03-24 21:55:19
My garfield,meyoung121219,https://i.redd.it/2krofukqsno41.jpg ,F,0,2020-03-24 21:54:30
Diego will try to get comfortable in ANY box.,kh8188,https://i.redd.it/cwqaayb9sno41.jpg ,F,0,2020-03-24 21:51:49
Which one is cute?,easyinterio,https://i.redd.it/y8txw975sno41.jpg ,F,0,2020-03-24 21:51:23
"Happy 10th birthday Moe! With that mustache, beard, and mohawk, you're a badass, little boy!",minkyflorianna,https://i.redd.it/9bp35zk4sno41.jpg ,F,0,2020-03-24 21:51:04
Just another day fishing for compliments on the internet,Jay3000X,https://i.redd.it/lx49fk8zrno41.jpg ,F,0,2020-03-24 21:50:23
Frodo seemed quite excited about turning 5 years old today,Alexthedalek,https://i.redd.it/69fvz8gurno41.jpg ,F,0,2020-03-24 21:49:30
Quarantine day 9 - Sick of it,DDarlinNikki,https://i.redd.it/053n9vsrrno41.jpg ,F,0,2020-03-24 21:49:06
Corgi was a snuggle buddy this weekend,MelodySloan1,https://i.redd.it/53qpyazmrno41.jpg ,F,0,2020-03-24 21:48:27
He clearly does not understand social distancing or working from home,builtbybama_rolltide,https://i.redd.it/d9tyuhwzqno41.jpg ,F,0,2020-03-24 21:44:45
Dapper Duck,KaaraRaven,https://i.redd.it/mf63rcjoqno41.png ,F,0,2020-03-24 21:43:24
Coco is making the best out of her quarantine and is enjoying the sunlight.,GatorQueen,https://i.redd.it/c3gyb9qnqno41.jpg ,F,0,2020-03-24 21:42:51
My quarantine buddy,BearDown75,https://i.redd.it/ggur3vygqno41.jpg ,F,0,2020-03-24 21:41:56
"My mom and dad just dropped this off for my birthday. It was a very nice surprise for certain, all while keeping a safe distance apart. Made my day a lot brighter :)",kittykatmorris2390,https://i.redd.it/uij899sgqno41.jpg ,F,0,2020-03-24 21:41:55
Needs snuggles ASAP,EstesParkRanger,https://i.redd.it/b6enm18hqno41.jpg ,F,0,2020-03-24 21:41:50
They’re happy dad is stuck at home.,liseybear3,https://i.redd.it/6dt4perfqno41.jpg ,F,0,2020-03-24 21:41:40
"My Dog, Wrangler, Sunbathing.",biglettt,https://i.redd.it/w1hu7k89qno41.jpg ,F,0,2020-03-24 21:40:35
"This sub helped me name my plant, Puppy. He’s the only living thing keeping me company. He’s growing new shoots!",Hedgie_Herder,https://i.redd.it/9gr781d6qno41.jpg ,F,0,2020-03-24 21:40:16
"I did a photoshoot with my cat, this shot melts my heart",oreanta,https://i.redd.it/rjld8sj0qno41.jpg ,F,0,2020-03-24 21:39:13
Bess is all about self quarantining,dart51984,https://i.redd.it/j9du03ctpno41.jpg ,F,0,2020-03-24 21:38:06
One happy boy,CarminesWrath,https://i.redd.it/kkajkirqpno41.jpg ,F,0,2020-03-24 21:37:42
teacher shows birds at the end of online class,keatches,https://i.redd.it/wfd0fe0gpno41.jpg ,F,0,2020-03-24 21:36:22
My boy Chip was real happy to get out of the apartment and go for a ride!,chillmonday,https://i.redd.it/ll6m4f4bpno41.jpg ,F,0,2020-03-24 21:35:21
Lions: The Uniquely Social 'King of the Jungle' And Best Couple For Ever.,jennifer3388,https://i.redd.it/fxttedpzono41.jpg ,F,0,2020-03-24 21:34:49
Michelangelo’s painting recreated,The-Timbo,https://i.redd.it/a1fjo8nnono41.jpg ,F,0,2020-03-24 21:31:38
He devoted his life in rescuing Chihuahua whom nobody wants to keep,jakefrmstatefrmm,https://i.redd.it/29ntyst5cmn41.jpg ,F,0,2020-03-24 21:31:25
My cat loved sitting in the shower,RemiReed,https://i.redd.it/m9djnetkono41.jpg ,F,0,2020-03-24 21:31:11
Mlem,umblueberrypie,https://i.redd.it/dfs9cpkkono41.jpg ,F,0,2020-03-24 21:31:10
Getting ready for SIP,oinktank906,https://i.redd.it/7qyyp8miono41.jpg ,F,0,2020-03-24 21:30:51
Social Distancing is important.,couragethebravestdog,https://i.redd.it/vlojmnm5ono41.jpg ,F,0,2020-03-24 21:28:49
Oreo,heckbeast,https://i.redd.it/wdbgb4h1ono41.jpg ,F,0,2020-03-24 21:28:48
Even my cat is on lockdown!,SolarChipmunk,https://i.redd.it/ifpmkiy0ono41.jpg ,F,0,2020-03-24 21:28:05
Anyone else have a needy coworker these days?,Douchelock420,https://i.redd.it/yc6cmuxrnno41.jpg ,F,0,2020-03-24 21:26:42
Penny can't even today.,rover608,https://i.redd.it/n174w3brnno41.jpg ,F,0,2020-03-24 21:26:39
When the self isolating gaming binge gets too much,justaloadofshite,https://i.redd.it/xoe4mhcmnno41.jpg ,F,0,2020-03-24 21:25:49
Subtle Wink Wink,can-i-get-a-blueline,https://i.redd.it/stsswwolnno41.jpg ,F,0,2020-03-24 21:25:43
"Found an old photo of my family dog and Karen the lioness cub. From what I’m told, they had an adorable chemistry.",zellie-loves-black,https://i.redd.it/e98j5g2enno41.jpg ,F,0,2020-03-24 21:24:34
Keeping her best bud company while he is stuck home doing his schoolwork,seaturtle79,https://i.redd.it/1gtiv2janno41.jpg ,F,0,2020-03-24 21:24:00
maybe maybe maybe,jasontaken,https://i.redd.it/1p5h6801ino41.gif ,F,0,2020-03-24 21:22:10
individual holding white cat with blossoms accessory,kashi12300,https://i.redd.it/3mzqfsd8e0p41.jpg ,F,0,2020-03-26 16:16:48
"Meet Detective Patrick, he's very professional at his job",YigitAras,https://i.redd.it/db02rry7e0p41.png ,F,0,2020-03-26 16:16:21
"""Its ok dad, we'll find room!""",Donnelly88,https://i.redd.it/1jlzi495e0p41.jpg ,F,0,2020-03-26 16:15:56
My car is sleeping with me!,2cool4Fortnite,https://i.redd.it/i2b23g23e0p41.jpg ,F,0,2020-03-26 16:15:32
My work-from-home buddy,twilighttruth,https://i.redd.it/9ki2bw32e0p41.jpg ,F,0,2020-03-26 16:15:26
Very tired,EleCre3p,https://i.redd.it/sf4s0h9td0p41.jpg ,F,0,2020-03-26 16:14:03
"My adoptive strays! They're the bestest boys, aren't they?",bitchnooo,https://i.redd.it/nhyv0bvqd0p41.jpg ,F,0,2020-03-26 16:13:45
Shasty the sailor our good girl!,mardav5752,https://i.redd.it/rw17x8vbd0p41.jpg ,F,0,2020-03-26 16:11:19
Passed out on his buddy,goodgolly_msdolly,https://i.redd.it/pgyonqg5d0p41.jpg ,F,0,2020-03-26 16:10:23
Pupper posing for my cake day,zachhambo,https://i.redd.it/87zxmcs4d0p41.jpg ,F,0,2020-03-26 16:10:20
"Since many of you appreciated the last pic, here's another",monte_hyena,https://i.redd.it/wqu9dqgqc0p41.jpg ,F,0,2020-03-26 16:08:00
My dog Balboa wrapped up in the blankets,Varient647,https://i.redd.it/9jz7u5mmc0p41.jpg ,F,0,2020-03-26 16:07:23
My dog watching me eat my sandwich,Foxy345278,https://i.redd.it/3n1ivgmmc0p41.jpg ,F,0,2020-03-26 16:07:22
Saw a post that reminded me of my own cat... god I miss this little guy so much,LeZela,https://i.redd.it/grkl96c0c0p41.jpg ,F,0,2020-03-26 16:03:53
Isnt he cute,linerr11,https://i.redd.it/5ft8d6ntb0p41.jpg ,F,0,2020-03-26 16:02:53
Being locked indoors isn't all that bad now that we have a puppy!,Kokushi,https://i.redd.it/zq4aq2wfb0p41.jpg ,F,0,2020-03-26 16:00:48
My family dog likes to hold your hand to be invited into the sofa,philogrobizedeclipse,https://i.redd.it/zx5wyltbb0p41.jpg ,F,0,2020-03-26 16:00:14
"Follow up to my last post: this actual baby pushed me over when I was sitting next to her, then flashes me her goofy ass smile.",okberma,https://i.redd.it/0el41qf2b0p41.jpg ,F,0,2020-03-26 15:58:37
Cute goat buddies,pussyhunter69420_,https://i.redd.it/spjbocpxa0p41.jpg ,F,0,2020-03-26 15:57:53
Get your free hugs!,b12ftw,https://i.redd.it/rbbn8fvna0p41.jpg ,F,0,2020-03-26 15:56:36
Day 8 of self-isolation: Juno still acts like we don’t care about her. The only time she’s actually been alone has been when she sleeps,okberma,https://i.redd.it/jufxa1gia0p41.jpg ,F,0,2020-03-26 15:55:31
"I sucessfully grew a Cat! Any tips for water, soil and sunlight?",HaleyPanics,https://i.redd.it/hpdbottl90p41.jpg ,F,0,2020-03-26 15:50:25
Nothing better than waking up to this every morning.,stratface4000,https://i.redd.it/f3n1vyug90p41.jpg ,F,0,2020-03-26 15:49:49
shelter in place expert,CarlitaFrijolita,https://i.redd.it/4vibnofh90p41.jpg ,F,0,2020-03-26 15:49:45
"Spectacled or Andean bears are the only bears native to South America. Paddington Bear, a children's character, is based on this bear species.",mlouisa70394,https://i.redd.it/cy0g5dx490p41.jpg ,F,0,2020-03-26 15:47:54
"They love eachother so much •́ ‿ ,•̀",everybodyswaifu,https://i.redd.it/bbqawxd680p41.jpg ,F,0,2020-03-26 15:43:13
Long girl likes her long toy,jkot84,https://i.redd.it/dgjr31kk70p41.jpg ,F,0,2020-03-26 15:39:05
She the queen of the park,someoneveryblue,https://i.redd.it/rfsv0u3d70p41.jpg ,F,0,2020-03-26 15:37:53
Hello! Hi! Your call took me by surprise. Happy to hear from you.,iglobalupdates,https://i.redd.it/6qpet7ke50p41.jpg ,F,0,2020-03-26 15:35:22
What the difference?,BigBusterBrown729,https://i.redd.it/sn5rffxj50p41.jpg ,F,0,2020-03-26 15:27:43
Can i tell about my subreddit with more photos?,Anbarus,https://i.redd.it/bdq0vmb550p41.jpg ,F,0,2020-03-26 15:25:29
That look when your bae cancel your plan and join others.,onekindstore,https://i.redd.it/ek6rnpgp40p41.jpg ,F,0,2020-03-26 15:24:18
My roommate FaceTimes his little sister every week to help her with Algebra.,Alarmed_Health,https://i.redd.it/17dnad8s75yz.jpg ,F,0,2020-03-26 15:20:26
Can I offer you a cat in these trying times? Her name is Lyra,ImADecentRedditor,https://i.redd.it/acug67n840p41.jpg ,F,0,2020-03-26 15:20:26
He long and he forget his feet,ashlouyy1235,https://i.redd.it/qp49h0y340p41.jpg ,F,0,2020-03-26 15:19:39
Her smile is just not fair,negasonicwhattheshit,https://i.redd.it/8j3qwd6240p41.jpg ,F,0,2020-03-26 15:19:24
the bliss is enviable but the love is just stronger,Jtaimelafolie,https://i.redd.it/dcc7sbp040p41.jpg ,F,0,2020-03-26 15:19:06
Best Friend forever,abs16,https://i.redd.it/9kf0m0pu30p41.png ,F,0,2020-03-26 15:18:34
Whatsapp video call with my gf dog,thezixx,https://i.redd.it/j12jjiiq30p41.png ,F,0,2020-03-26 15:17:31
Grown up,Ap3xWingman,https://i.redd.it/6icng9nz20p41.jpg ,F,0,2020-03-26 15:13:21
Adorable German shepherd pup,pussyhunter69420_,https://i.redd.it/ppy8u4l520p41.jpg ,F,0,2020-03-26 15:08:39
How to make a perfect star,utkarsh_aryan,https://i.redd.it/ib3nviok10p41.jpg ,F,0,2020-03-26 15:07:04
He loves sleeping on my PJs!,Siss0koXNd0mbele,https://i.redd.it/1otuoduh10p41.jpg ,F,0,2020-03-26 15:05:03
shes a chonker,TheSmoothCriminal69,https://i.redd.it/l2xj68tf10p41.jpg ,F,0,2020-03-26 15:04:40
Kutest kitten,pussyhunter69420_,https://i.redd.it/wmn1g3cd10p41.jpg ,F,0,2020-03-26 15:04:15
My little Kiara likes to sleep behind me as I work from home. Today she slept so deeply that she didn’t wake up as I got up - allowing me to take this adorable photo!,KiaraPooh,https://i.redd.it/3beo2r5c10p41.jpg ,F,0,2020-03-26 15:04:08
"This is Ginger, and today is her birthday. :) She's 7 now.",Arnoods,https://i.redd.it/pumf52k510p41.jpg ,F,0,2020-03-26 15:03:05
I have never seen a baby flamingo until today and they are just so cute.,utkarsh_aryan,https://i.redd.it/w58wxozw00p41.jpg ,F,0,2020-03-26 15:03:00
A couple of hooligans...who us?,Injalie,https://i.redd.it/zeagcug310p41.jpg ,F,0,2020-03-26 15:02:45
Say hi to this handsome pup!,heytine,https://i.redd.it/m47dk6lm00p41.jpg ,F,0,2020-03-26 15:00:11
My bulldog likes to sleep during the day and party at night. Well due to the quarantine I work from home and I will randomly make loud noises to wake him up. This is the look I get every time.,william148512,https://i.redd.it/3tfh8lvm00p41.jpg ,F,0,2020-03-26 15:00:10
"Not my cat, just looking at cat pics to pass the time in isolation... Wish I had my cats",TheAbbadon,https://i.redd.it/lu8bxw5l00p41.jpg ,F,0,2020-03-26 14:59:53
"Thought it was about time the internet saw another picture of my girl, Here you go!",Fork_the_derper,https://i.redd.it/6jizokhxzzo41.jpg ,F,0,2020-03-26 14:56:50
It’s going to be okay,ladywafflesisqueen,https://i.redd.it/lgrq455wzzo41.jpg ,F,0,2020-03-26 14:56:04
He found a bee friend:),StormKiller1,https://i.redd.it/64h6ujqqzzo41.jpg ,F,0,2020-03-26 14:55:09
Not so great at social distancing,Beelzeboop986,https://i.redd.it/j0qwwoytyzo41.jpg ,F,0,2020-03-26 14:50:19
Oil painting of my cat Elmer,buzzwole1,https://i.redd.it/8lsqp93nyzo41.jpg ,F,0,2020-03-26 14:48:59
This little Tarsier would just like to say hello and hopes everyone is doing okay.,gregfrompayroll,https://i.redd.it/flpre1cdyzo41.jpg ,F,0,2020-03-26 14:47:26
Murphy the 14 year old Springer,sniffyerbaws,https://i.redd.it/j8f6ibkrxzo41.jpg ,F,0,2020-03-26 14:44:07
even star boys take break from their all day swag!,sunnysideuphere,https://i.redd.it/oa1bj12kxzo41.jpg ,F,0,2020-03-26 14:43:25
“If we have to get a dog it will NOT be a German Shepherd!”,50percentDNA,https://i.redd.it/05oypse6xzo41.jpg ,F,0,2020-03-26 14:40:45
I present the happiest boi,Grimble5000,https://i.redd.it/bq3u50l3wzo41.jpg ,F,0,2020-03-26 14:34:42
Nose kisses!,nighthawke75,https://i.redd.it/0xryfxqgtjm41.jpg ,F,0,2020-03-26 14:34:27
Quarantine friends. Greetings from Italy,johnny_ego,https://i.redd.it/jw1d0qvwvzo41.jpg ,F,0,2020-03-26 14:34:21
Look at that little guy,SnubSnob,https://i.redd.it/rkijtw6fxwo41.jpg ,F,0,2020-03-26 14:32:35
The cats are socially distancing...,sooperpook77,https://i.redd.it/a20w62c9vzo41.jpg ,F,0,2020-03-26 14:30:01
my cute little cat...,Catsmania4u,https://i.redd.it/8v05b23wuzo41.jpg ,F,0,2020-03-26 14:28:21
"Sister, sister",mmmmliz,https://i.redd.it/ae9usbbxuzo41.jpg ,F,0,2020-03-26 14:28:08
Birthday Girl! Just turned 1. #beaglemation,squeakathon,https://i.redd.it/fma21l9quzo41.jpg ,F,0,2020-03-26 14:27:02
Some good company in these scary times!,darthspasticator,https://i.redd.it/4eao8lrutzo41.jpg ,F,0,2020-03-26 14:22:07
I'm I ready for proposal?!,Thedailypetss,https://i.redd.it/a32o1ru1tzo41.jpg ,F,0,2020-03-26 14:17:38
Someone had a visitor on their drive this morning,Mickey_stan,https://i.redd.it/e6rcn7ezrzo41.jpg ,F,0,2020-03-26 14:11:38
I'll just go wash my...,DrThr4xx,https://i.redd.it/4wsubr5xrzo41.jpg ,F,0,2020-03-26 14:11:21
My new colleague refuses to comply with the rules of social distancing at the office,Crispyji,https://i.redd.it/v3jk31jdqzo41.jpg ,F,0,2020-03-26 14:02:39
My dog in the woods patiently waiting for my dad to finish his painting,JaniGoose,https://i.redd.it/slygb7eaqzo41.jpg ,F,0,2020-03-26 14:02:11
Shhh she's sleeping,JulesBurnz,https://i.redd.it/ul50ihp9qzo41.jpg ,F,0,2020-03-26 14:02:02
I’ve been stressing about all the covid/quarantine stuff so Luca brought me a chew stick to calm me down. He’s the best boy.,Anon12109,https://i.redd.it/2qpjsmbkpzo41.jpg ,F,0,2020-03-26 13:58:15
Dis goob makes this face every time he gets scratches,eloelocin,https://i.redd.it/zkapphwepzo41.jpg ,F,0,2020-03-26 13:57:17
Hi Reddit! Meet Chandler! He has the tendency to behave bizarre. But it's just a vase!,BrandoCrow,https://i.redd.it/ilkhr2qpozo41.jpg ,F,0,2020-03-26 13:55:27
"Looking after a family dog in these quaran-trying times, here’s Bean! PS: We’re from Norway but Bean is his actual name, he’s a good american boi.",Day_Man_Charlie,https://i.redd.it/r6pmfbisozo41.jpg ,F,0,2020-03-26 13:53:47
My boy giving up on asking for attention while I work. Defeated.,Brasswoman,https://i.redd.it/3ghgyghjozo41.jpg ,F,0,2020-03-26 13:52:51
The one good shot out of about 10. She is just so pretty tho,sqweet92,https://i.redd.it/xfuinazvmzo41.jpg ,F,0,2020-03-26 13:45:23
"In these tough times, everyone needs a little cuddle.",ndab71,https://i.redd.it/dtrea447nzo41.jpg ,F,0,2020-03-26 13:44:50
It's not nice to stick out your tongue like that,kajtekkk,https://i.redd.it/dfsmw77hmzo41.jpg ,F,0,2020-03-26 13:40:47
Chilling with his blanket,Yass_this_is_good619,https://i.redd.it/hp69brwbmzo41.jpg ,F,0,2020-03-26 13:39:59
He's just a sleep guy.,siikpsychotiik,https://i.redd.it/nihcccd6mzo41.jpg ,F,0,2020-03-26 13:39:10
"Because I saw the video of the cat using his man-pet's hand to cover his eyes... : My cat is a big boi, he ain't need anyone.",uzOvl,https://i.redd.it/1zp9kmqxlzo41.jpg ,F,0,2020-03-26 13:37:47
"Anybody that knows why they sometimes hate each other, and then can lay in the same room right after??",xand0129,https://i.redd.it/ihjettkqlzo41.jpg ,F,0,2020-03-26 13:36:38
Cuteness overload,pussyhunter69420_,https://i.redd.it/ciactisplzo41.jpg ,F,0,2020-03-26 13:36:31
Paint me like one of your French cats...,enozoria,https://i.redd.it/qcwxwhfblzo41.jpg ,F,0,2020-03-26 13:34:19
He stares deep into my soul when I’m eating something he wants,noms201,https://i.redd.it/eentqal8lzo41.jpg ,F,0,2020-03-26 13:33:50
My kitten and my dog are getting along nicely,XxWa1kerxX,https://i.redd.it/nxa1ek6xkzo41.jpg ,F,0,2020-03-26 13:32:05
Idk why but this photo seems so cute,FearMyMinecraft,https://i.redd.it/ryj7vzhskzo41.jpg ,F,0,2020-03-26 13:31:20
"Thick thighs, pretty eyes XD",asaatn,https://i.redd.it/94w7yj87kzo41.jpg ,F,0,2020-03-26 13:28:02
My two nut jobs in their kennel..,crazygoatladynz,https://i.redd.it/d0koxohyizo41.jpg ,F,0,2020-03-26 13:21:06
"Here's all 3 Quarantine Wiener buds (top to bottom: Buddy, Frankly Franks, and Princess Tacocat)",JRocketts210,https://i.redd.it/zv5ds2srizo41.jpg ,F,0,2020-03-26 13:20:00
Bohemian catsody,dramaticmanchild,https://i.redd.it/tl27qp9jizo41.jpg ,F,0,2020-03-26 13:18:40
They say it's hard to get a decent picture of a black cat. I'm quickly learning that while fostering these two babies.,btheb90,https://i.redd.it/rh3zh0tbizo41.jpg ,F,0,2020-03-26 13:18:09
So cute but...,frenchexploreur,https://i.redd.it/nk872s43izo41.jpg ,F,0,2020-03-26 13:16:28
Bug eyes,this_isnt_jamie,https://i.redd.it/eeqolapvhzo41.jpg ,F,0,2020-03-26 13:15:01
:),Kostan-dei-Rina,https://i.redd.it/eznq5e5ehzo41.jpg ,F,0,2020-03-26 13:12:17
"I loved the photo of Dik, the 21-year-old hunting dog, so I drew a small tribute!",MorganFaulkner,https://i.redd.it/vvthv74rgzo41.png ,F,0,2020-03-26 13:08:44
"My cat, Rorschach, found a hiding place",yakkmeister,https://i.redd.it/kmle8atagzo41.jpg ,F,0,2020-03-26 13:06:12
"Meet our new family member, we adopted her yesterday she is such a sweetheart, girlfriend has named her Luna",AsherChez,https://i.redd.it/49us40z7gzo41.jpg ,F,0,2020-03-26 13:05:58
Quarantine wieners,JRocketts210,https://i.redd.it/etvjpcywfzo41.jpg ,F,0,2020-03-26 13:04:02
"Aren't you supposed to break your neck, sleeping like that?",delph_le_dauphin,https://i.redd.it/gya3kxynfzo41.jpg ,F,0,2020-03-26 13:02:37
"My cat in action looking at me, taking a picture of it",gestriger,https://i.redd.it/pi1ns3sifzo41.jpg ,F,0,2020-03-26 13:01:48
