NAME,AUTHOR,LINK,T/F,UPVOTES,DATE-TIME
"At least three weeks isolation with my best pal, he's happy everyone's home",Keenia,https://i.redd.it/jmn7hcpw9no41.jpg ,F,0,2020-03-24 20:09:02
So tiny🥺 pic credit: a Newegg ad,19CPS,https://i.redd.it/11txb2wt9no41.jpg ,F,0,2020-03-24 20:08:31
Alfie doesn’t mind quarantine,chalillianaire,https://i.redd.it/wef8dxmt9no41.jpg ,F,0,2020-03-24 20:08:29
"Mr. ""You Can't Take My Stick Away"" Loki",Madeline6301,https://i.redd.it/pgtoa62c9no41.jpg ,F,0,2020-03-24 20:05:45
Hummingbird Chicks,MaxPickles,https://i.redd.it/ohxyeuh89no41.png ,F,0,2020-03-24 20:05:39
My crew.,mick1012,https://i.redd.it/gh6ec5s39no41.jpg ,F,0,2020-03-24 20:04:30
"My coworker, Cooper - sleeping on the job.",beer_water,https://i.redd.it/szpeiyiv8no41.jpg ,F,0,2020-03-24 20:03:13
Saw this squirrel in the Hoh rainforest.,fokisgaming,https://i.redd.it/uuyft29o8no41.jpg ,F,0,2020-03-24 20:02:08
Here are some snuggling puppies (with a bonus blop) to get you through your quarantine!,FacesReddit,https://i.redd.it/2iaysjum8no41.jpg ,F,0,2020-03-24 20:01:49
This quarantine has everyone bored,vZAPP,https://i.redd.it/wdbjhdye8no41.jpg ,F,0,2020-03-24 20:00:35
The pack taking care of my wife after her hip surgery,exdwsa78,https://i.redd.it/p67jolhb8no41.jpg ,F,0,2020-03-24 20:00:05
My work-from-home battlestation,awesomedan24,https://i.redd.it/xvh50aj68no41.jpg ,F,0,2020-03-24 19:59:16
"""Working"" from home",FirevsEverything,https://i.redd.it/fjtk7ili7no41.jpg ,F,0,2020-03-24 19:58:49
At home workouts are going well,bogbunzhun,https://i.redd.it/dmrzf1k18no41.jpg ,F,0,2020-03-24 19:58:30
Yes i did sugar bear,Cary7893,https://i.redd.it/g7o4k81j6no41.jpg ,F,0,2020-03-24 19:57:03
Quarentine cuddles,JTR_17,https://i.redd.it/2a8fif7n7no41.jpg ,F,0,2020-03-24 19:56:18
"Ears up and a blep - sorry for the bad quality, I didn't want to disturb them",no-property,https://i.redd.it/4h4pbl547no41.jpg ,F,0,2020-03-24 19:53:49
“Read me another story mom. Pretty pleassssse!”,poobsgregory,https://i.redd.it/dhxtn1c77no41.jpg ,F,0,2020-03-24 19:53:48
9 days old kitten,ImadeALogan,https://i.redd.it/ujag7szz6no41.jpg ,F,0,2020-03-24 19:52:42
"Bored puppy waiting on the vet, banana for scale",whoisjacobjones,https://i.redd.it/3rz59d9o6no41.jpg ,F,0,2020-03-24 19:50:49
Bandit gives you his daily smile,lastchancelast,https://i.redd.it/vu4w995g6no41.jpg ,F,0,2020-03-24 19:49:36
Quiet pls. An old lady is taking a nap,Nocturnal_Person,https://i.redd.it/fv0x2kvc6no41.jpg ,F,0,2020-03-24 19:49:04
Me: giving Pat's to my doggo at 10 in the morning.,SupremeLeader-Snoke,https://i.redd.it/qfh59oy16no41.jpg ,F,0,2020-03-24 19:47:28
Work from home,iiithewizardiii,https://i.redd.it/2vzziik06no41.gif ,F,0,2020-03-24 19:47:16
Henlo,Terminallyelle,https://i.redd.it/7qfuinzc5no41.jpg ,F,0,2020-03-24 19:45:34
Useful advice from the axolotl Mr.Yoo,airevgeny,https://i.redd.it/o3zc2f1ukko41.jpg ,F,0,2020-03-24 19:45:13
"Meet Smoothie, World’s Most Photogenic Cat",krisstijannn,https://i.redd.it/s7641a5n5no41.jpg ,F,0,2020-03-24 19:45:07
The bathtub dripping water is better than the fresh bowels he receives daily. Simon has only recently developed this habbit. He's 16 going on 17.,Jennajo97,https://i.redd.it/w3y7ztwm5no41.jpg ,F,0,2020-03-24 19:45:04
Siberian Cats,krisstijannn,https://i.redd.it/wss07yxj5no41.jpg ,F,0,2020-03-24 19:44:36
Luan - Gorgeous Norwegian Forest Cat,krisstijannn,https://i.redd.it/ebqjk8rf5no41.jpg ,F,0,2020-03-24 19:44:04
My dad sent me this pic of our girl enjoying some sun,AlexanderAone,https://i.redd.it/zbw7m8uf5no41.jpg ,F,0,2020-03-24 19:43:56
"Black lemurs are native to the forests of northwestern Madagascar. They primarily eat fruit, but they also have developed a habit of mildly biting into toxic millipedes whose glandular secretions cause the lemurs to get high and salivate alot. When applied to their fur, the toxins wards off insects.",louisamarisa,https://i.redd.it/02kutskn4no41.gif ,F,0,2020-03-24 19:39:46
Day 7 of quarantine blep,Douchelock420,https://i.redd.it/gaeko7wh4no41.jpg ,F,0,2020-03-24 19:38:37
Puppy after haircut.,BBHS123,https://i.redd.it/ry9jtapa4no41.jpg ,F,0,2020-03-24 19:37:31
Apparently my dog doesn’t approve of me pooping,Anonimatoria,https://i.redd.it/jomq9do74no41.jpg ,F,0,2020-03-24 19:37:07
Can I not take a bath by myself?,kansasdesigner,https://i.redd.it/j1r4e8ra3no41.jpg ,F,0,2020-03-24 19:31:56
Our little monster keeps trying to jump from the couch to the table.,Theitalian88,https://i.redd.it/teae2nr73no41.jpg ,F,0,2020-03-24 19:31:26
"Normally Milo is pretty camera shy, but I guess quarantine has warmed him up to it!",ObsidianPirate2000,https://i.redd.it/4s3uj3653no41.jpg ,F,0,2020-03-24 19:31:02
Here is looking at you - Blu our Cat - He will stare at you all day long.,Lumin8_Crypto,https://i.redd.it/dmfkklow2no41.jpg ,F,0,2020-03-24 19:30:22
Sweet boy spent the morning outside and came in shivering from the cold. We bundled him up and he's been like this for an hour,hamsammmich25,https://i.redd.it/l6qucp7m2no41.jpg ,F,0,2020-03-24 19:28:28
"She heard the snack cabinet open, but she's so cozy",Beththemagicalpony,https://i.redd.it/wfemqshi2no41.jpg ,F,0,2020-03-24 19:28:23
We had been wanting to get her a little brother for a long time. Now that we're working from home there was no better time!,TehWhitewind,https://i.redd.it/06g1bll92no41.jpg ,F,0,2020-03-24 19:26:12
Kitty love,Iangator,https://i.redd.it/e5b244562no41.jpg ,F,0,2020-03-24 19:25:49
That face💜💜💜,gaia420bitch,https://i.redd.it/eygkauo52no41.jpg ,F,0,2020-03-24 19:25:33
My dad brought home some new pets/emergency apocalypse supply's. This is Pippin.,joey_bm42,https://i.redd.it/kx9vvdnz1no41.jpg ,F,0,2020-03-24 19:24:38
Happy sleeping boy💜,gaia420bitch,https://i.redd.it/2fwtkxux1no41.jpg ,F,0,2020-03-24 19:24:18
Spending isolation with this sweet girl,SadRegular,https://i.redd.it/mg17cmzv1no41.jpg ,F,0,2020-03-24 19:24:00
Good times,Why-My-PeePee-Smelly,https://i.redd.it/fr2qn2xi1no41.jpg ,F,0,2020-03-24 19:21:58
It's been 5 years and she still sleeps with her bunny like this 🥰,anulka0091,https://i.redd.it/l9imtwxr0no41.jpg ,F,0,2020-03-24 19:17:54
Majestic!,Der_Ist,https://i.redd.it/ugcfyonq0no41.jpg ,F,0,2020-03-24 19:17:38
Cute Cat Forever My Dear Mini,jennifer3388,https://i.redd.it/wo2rnkhf0no41.jpg ,F,0,2020-03-24 19:16:37
Taking it easy,IloQueen,https://i.redd.it/ksyg6lci0no41.jpg ,F,0,2020-03-24 19:16:18
Taking a class with my boy ❤️,enough0729,https://i.redd.it/hcj2hu680no41.jpg ,F,0,2020-03-24 19:14:42
Work buddy,Aggressive-Flounder,https://i.redd.it/tgs9hlh10no41.jpg ,F,0,2020-03-24 19:13:40
This baby chick,TruthTeller_Really,https://i.redd.it/hc69fxdyzmo41.jpg ,F,0,2020-03-24 19:13:25
My dad hired a new intern while he works from home.,starspangledhammered,https://i.redd.it/mi3n5faozmo41.jpg ,F,0,2020-03-24 19:11:39
"Happy Kittens Day. That’s what he tells me, but I’m not sure i can trust him.",rdspdx,https://i.redd.it/vm1wbr4jzmo41.jpg ,F,0,2020-03-24 19:10:50
Hide-and-Seek,kaputtel,https://i.redd.it/qpgu41hyvmo41.jpg ,F,0,2020-03-24 19:09:56
Comfy,jhs2418869,https://i.redd.it/1txyt2tbzmo41.jpg ,F,0,2020-03-24 19:09:40
"I don't care if I'm on the table, hooman this is my box now.",Folsky,https://i.redd.it/wicnbrfqymo41.jpg ,F,0,2020-03-24 19:06:22
The cats are social distancing. Just doing their part.,McAvoy4Potus,https://i.redd.it/tdxy6038zmo41.jpg ,F,0,2020-03-24 19:09:05
Such cute. Much floof.,gregfrompayroll,https://i.redd.it/mssi0f3xymo41.jpg ,F,0,2020-03-24 19:07:21
"First post here, enjoy!",Fork_the_derper,https://i.redd.it/d3s19omrymo41.jpg ,F,0,2020-03-24 19:07:20
So my sister just made this,samsteak,https://i.redd.it/i359gylvymo41.jpg ,F,0,2020-03-24 19:07:09
I took this picture of my 7 week old foster puppy and realized how hilariously confused my cat looked afterwards,naetura,https://i.redd.it/9cgmc8ylymo41.jpg ,F,0,2020-03-24 19:05:40
"May I present Prince Valiant, our family’s lovable chonky boy.",Riker47,https://i.redd.it/3ibgqz9iymo41.jpg ,F,0,2020-03-24 19:05:03
Study buddy,Hamster_of_Death,https://i.redd.it/fv1i014dymo41.jpg ,F,0,2020-03-24 19:04:19
Not a bad wat to be woken up in the morning by this big galomf.,DeadOakDruud,https://i.redd.it/nb0yld18ymo41.jpg ,F,0,2020-03-24 19:03:29
Milky Way (14 year old leopard gecko) during feeding time! He is shedding.,ProwlerPlayzYT,https://i.redd.it/0ln6fto2ymo41.jpg ,F,0,2020-03-24 19:03:04
"“Hey, who turned off the lights?”",Rmc1025,https://i.redd.it/xlkh6rszxmo41.jpg ,F,0,2020-03-24 19:02:10
Bringing These Two Cuties Backc to Their Forever Home. Meet Remi (bottom) and Juno (that ear!).,lansingcycleguy,https://i.redd.it/uq7yai0rxmo41.jpg ,F,0,2020-03-24 19:01:49
When you’re taking professional pictures of your kitty and she has the sudden urge to sneeze.,JustTom1,https://i.redd.it/36pj20lpxmo41.jpg ,F,0,2020-03-24 19:00:35
"Sorry for bad quality, didn't want to disturb them",AnywaysIsntReal,https://i.redd.it/6ukpiab3xmo41.jpg ,F,0,2020-03-24 18:57:11
SweetPea would like you to stop and boop her snoot.,74CJ5Chick,https://i.redd.it/rp14oc2wwmo41.jpg ,F,0,2020-03-24 18:56:05
She's 51 kg of love,getthedogs,https://i.redd.it/uf2va7wtwmo41.jpg ,F,0,2020-03-24 18:55:41
Warmth,Nathanthewaffle,https://i.redd.it/739z9wtiwmo41.jpg ,F,0,2020-03-24 18:53:56
Look at him sleeping out there hes just pure cuteness,Enderguy118,https://i.redd.it/k8jeaj9hwmo41.jpg ,F,0,2020-03-24 18:53:44
"We took an old carseat out to wash and give away, and my boy decided we should keep it instead",KoolShrooms,https://i.redd.it/lhmmr2yawmo41.jpg ,F,0,2020-03-24 18:53:00
Isolation has us all feeling a little loopy,layna_theo,https://i.redd.it/cp5ywpx7wmo41.jpg ,F,0,2020-03-24 18:52:15
Eddie is growing up beautifully and is proving to be a superb isolation buddy. He's sad that he's not allowed to go to puppy classes and play with other dogs but he is growing very fond of these walk things he's been told about!,noskcajluap,https://i.redd.it/y8lrztl6wmo41.jpg ,F,0,2020-03-24 18:52:03
Daddy and daughter nap time ❤️🐶,Jambo76fi,https://i.redd.it/58nd1awvvmo41.jpg ,F,0,2020-03-24 18:50:27
Back when my baby was little,JigokuShoujo87,https://i.redd.it/9kp6fyouvmo41.jpg ,F,0,2020-03-24 18:50:13
Spike trying to eat his mealworms in peace,ginapsallidas,https://i.redd.it/c25mshbsvmo41.jpg ,F,0,2020-03-24 18:49:51
A lizard can blep too,sSeph,https://i.redd.it/3dw7e42ovmo41.jpg ,F,0,2020-03-24 18:49:24
My quarantine buddy,corpusarium,https://i.redd.it/22vwjydnvmo41.jpg ,F,0,2020-03-24 18:49:23
Beautiful butterfly inside the house,cyber_cleen,https://i.redd.it/t6u8mm6lvmo41.jpg ,F,0,2020-03-24 18:48:41
This cute kitty hiding behind the wall! [OC],1ZacNolan1,https://i.redd.it/cis3y7ejvmo41.jpg ,F,0,2020-03-24 18:48:28
"My friend's kid turned 10, and couldn't have a birthday party because of social distancing. A boy who has a crush on her dropped off a birthday card and drawing of her favorite hot sauce. Definitely a keeper.",jcb42x,https://i.redd.it/tkqzqsfzumo41.jpg ,F,0,2020-03-24 18:45:29
Mom took this photo of our kittens today - it is worth sharing,Ryugo,https://i.redd.it/4nw8r7zaumo41.jpg ,F,0,2020-03-24 18:42:24
My 12 Y/O boy Samson sleeping on my favorite hoodie,Maingan_,https://i.redd.it/begoc155umo41.jpg ,F,0,2020-03-24 18:41:24
"pikachu, my 2 year old bird after the rain",Thi_Lima,https://i.redd.it/nzqllmy8umo41.jpg ,F,0,2020-03-24 18:41:11
Keeping me company during the UK lockdown,briggsteronimacaroni,https://i.redd.it/jro7ft6otmo41.jpg ,F,0,2020-03-24 18:38:10
Catching snowflakes,DalmationSpots,https://i.redd.it/f30mnrqjtmo41.jpg ,F,0,2020-03-24 18:37:53
We made a tank for our cat. Awww she loves her tank ❤️🐾,KaraSunMeow,https://i.redd.it/zrjx2pyltmo41.jpg ,F,0,2020-03-24 18:37:36
Someone's ready for me to go back to work,QuarterLifeCrisis91,https://i.redd.it/9c1g9fk9tmo41.jpg ,F,0,2020-03-24 18:35:43
It's my dogs ' gotcha day ' he's been with us for five years! This is a photo of his first night with us.,flea902,https://i.redd.it/k64gxdkbsmo41.jpg ,F,0,2020-03-24 18:30:22
Just a pup and his duck,whalegut,https://i.redd.it/h48c4vsasmo41.jpg ,F,0,2020-03-24 18:30:16
My lil pupper sleepi,Icy_Hot_Soba,https://i.redd.it/q7d4u6easmo41.jpg ,F,0,2020-03-24 18:30:12
"In times like these, we have to stay confined to our homes!",MyWolfIsDire,https://i.redd.it/6jnivcy7smo41.jpg ,F,0,2020-03-24 18:29:50
Fred is happy everyone is suddenly home and eating at the table.,eechrst,https://i.redd.it/3u6w9xu4smo41.jpg ,F,0,2020-03-24 18:29:24
My cat,DelusionalRetard12,https://i.redd.it/3wc8d75urmo41.jpg ,F,0,2020-03-24 18:27:41
Meet My Cute Jammy,jennifer3388,https://i.redd.it/gvo33pqjrmo41.jpg ,F,0,2020-03-24 18:26:24
Waiting his/her turn to the supermarket,TsonK,https://i.redd.it/lt29mpqhrmo41.jpg ,F,0,2020-03-24 18:25:46
Don’t know what I would do without this lard ass.,buhoes,https://i.redd.it/hfms01nhrmo41.jpg ,F,0,2020-03-24 18:25:42
This is Gary he is cool,gohawks37,https://i.redd.it/2j5hgexcrmo41.jpg ,F,0,2020-03-24 18:25:00
Lil guy did a non nom,winkysocks21,https://i.redd.it/4tw5g7i9rmo41.jpg ,F,0,2020-03-24 18:24:27
My cat likes international economics i guess,teibol,https://i.redd.it/hhsurfx2rmo41.jpg ,F,0,2020-03-24 18:24:00
The legacy of the king of forest,Stock-Acanthisitta,https://i.redd.it/tnl6938xqmo41.jpg ,F,0,2020-03-24 18:22:43
Look at this cat in an IKEA,SnubSnob,https://i.redd.it/ny3cstnqqmo41.png ,F,0,2020-03-24 18:21:30
Why sleep in the box when you can pull out and sleep on the packaging,Xilea1,https://i.redd.it/93e1n22lqmo41.jpg ,F,0,2020-03-24 18:20:39
My axolotl Jelly is keeping me sane during quarantine,cats_n_things,https://i.redd.it/l53er94cqmo41.jpg ,F,0,2020-03-24 18:19:18
For a brief moment all is right in the world,Bdoggy10,https://i.redd.it/srb74kwbqmo41.jpg ,F,0,2020-03-24 18:19:16
Little Noodle says Good Morning!,AnonymousWolf93,https://i.redd.it/2oyvo4n3qmo41.jpg ,F,0,2020-03-24 18:18:05
Cuteness overload,aaf97,https://i.redd.it/o1ekixvupmo41.jpg ,F,0,2020-03-24 18:16:35
my insanely hyper mini dachshund pretending to be a good girl for the camera,FaryRochester,https://i.redd.it/jsmxerdepmo41.jpg ,F,0,2020-03-24 18:16:31
"The ""Gordita""",alfre5vich,https://i.redd.it/elwwcb8upmo41.jpg ,F,0,2020-03-24 18:16:29
When you're quarantined with toddlers,ceqwz,https://i.redd.it/aym2qronpmo41.jpg ,F,0,2020-03-24 18:15:27
"My fluffy buddy , Goose",boomertrash_84,https://i.redd.it/2qroywnkpmo41.jpg ,F,0,2020-03-24 18:15:19
I always build little blankie forts for my kitty before I go to work.,Fruitslave,https://i.redd.it/ymzg77mjpmo41.jpg ,F,0,2020-03-24 18:14:49
Meet my new baby rabbit.My cat found him and brought him to my door.Decided to keep him and currently looking for good name suggestions.Im not sure if it's a boy or girl so just give me names for both genders.,anekoko,https://i.redd.it/iph3a0eipmo41.jpg ,F,0,2020-03-24 18:14:40
Just look at these faces!! 😛😳😲,YouNeedToCalmDown_,https://i.redd.it/lvw43e90pmo41.jpg ,F,0,2020-03-24 18:13:33
Fred's reaction to the quarantine: full cinnamon roll,TheyCallMeLurch,https://i.redd.it/ktdyil9somo41.jpg ,F,0,2020-03-24 18:11:14
"Dont worry bud, you are loved too!",patronsaintofshinies,https://i.redd.it/0r3kg3rromo41.jpg ,F,0,2020-03-24 18:10:29
"Sometimes if I am close to him, he will stretch out a paw to touch me. Sometimes.",sixfootassassin20,https://i.redd.it/j4q1ekdmomo41.jpg ,F,0,2020-03-24 18:09:39
This is Mr Pickles. He has a lot of admirers on our street.,Cholsonic,https://i.redd.it/8pv40efiomo41.jpg ,F,0,2020-03-24 18:09:04
Working from home isn’t so bad.,DinoCooky,https://i.redd.it/md0jm33como41.jpg ,F,0,2020-03-24 18:08:03
"Had a long day yesterday, she’s very tired.",Thicc_Nugget69,https://i.redd.it/5vps01c4omo41.jpg ,F,0,2020-03-24 18:06:52
"Dog is happy I'm home so much. Does not understand social distancing, and won't to respond to it.",bradiation,https://i.redd.it/5mq9n8qrnmo41.jpg ,F,0,2020-03-24 18:06:21
Massive roars are super effective!,Naeojinx,https://i.redd.it/44nne7o0omo41.jpg ,F,0,2020-03-24 18:06:16
Shleepy boy,penisgirllick69,https://i.redd.it/wq0bvofenmo41.jpg ,F,0,2020-03-24 18:02:48
My dog pleased I’m home for lockdown,morganhumberhumber,https://i.redd.it/90jo4ej6nmo41.jpg ,F,0,2020-03-24 18:01:40
My 7 year old soldier,masterfire21,https://i.redd.it/nxka03ltmmo41.jpg ,F,0,2020-03-24 17:59:35
ctrl+c ctrl+v,MuchScarier,https://i.redd.it/06fuzq7smmo41.jpg ,F,0,2020-03-24 17:59:21
First post here :),papercuts21,https://i.redd.it/1brdsfmnmmo41.jpg ,F,0,2020-03-24 17:58:40
I was looking through old pictures and this is the time when my dog (Coco) meet a possum. She was interested but let it past.,I_Hate_Bruselsprouts,https://i.redd.it/tnbcao7emmo41.jpg ,F,0,2020-03-24 17:57:16
"Went bed alone last night and, woke up to him trying to cuddle.",dudeler524,https://i.redd.it/fg9nevccmmo41.jpg ,F,0,2020-03-24 17:56:54
You tell me if this blep was accidental or on purpose towards the doggo,sabocano,https://i.redd.it/p6r0sga8mmo41.jpg ,F,0,2020-03-24 17:56:39
Took care of this fella and his siblings a while ago in Beirut. I wonder what they became,Ldy_lei,https://i.redd.it/o10eq4x7mmo41.jpg ,F,0,2020-03-24 17:56:25
She’s fast asleep,RonnieM07,https://i.redd.it/avksdl44mmo41.jpg ,F,0,2020-03-24 17:55:58
Fred is getting real judgmental during this stay in order.,lilycats13,https://i.redd.it/p6zx9vl5mmo41.jpg ,F,0,2020-03-24 17:55:50
I luv him,Nigatrick420,https://i.redd.it/7rrn6s2vlmo41.jpg ,F,0,2020-03-24 17:54:25
I get the butt end of this cuddle.,Novareason,https://i.redd.it/yopucegwlmo41.jpg ,F,0,2020-03-24 17:54:23
My boys enjoying some cuddles and sun,MrAngryPineapple,https://i.redd.it/mqvj0hpulmo41.jpg ,F,0,2020-03-24 17:54:12
What a goofball,ScrollsByNoHowdy,https://i.redd.it/mu2coh2plmo41.jpg ,F,0,2020-03-24 17:53:14
Meow,AlexSimonCullar,https://i.redd.it/54iuqrihlmo41.jpg ,F,0,2020-03-24 17:52:46
Are you staying at home?,ZexyS,https://i.redd.it/u367u19glmo41.jpg ,F,0,2020-03-24 17:52:07
"Mr. Mittens recently turned six, and she's cuter than ever. Gotta love the coloring!",Pwatapous,https://i.redd.it/64z08j7elmo41.jpg ,F,0,2020-03-24 17:51:44
My little English Mastiff pupper Oakley,PremiumMob,https://i.redd.it/dxvtuc0dlmo41.jpg ,F,0,2020-03-24 17:51:22
My telework buddy!,w3ar3allr0b0ts,https://i.redd.it/ya4a09ublmo41.jpg ,F,0,2020-03-24 17:51:15
Just chillin,ricewires,https://i.redd.it/hmlm9spblmo41.jpg ,F,0,2020-03-24 17:51:14
Brother and (adopted) sister.,RonnieM07,https://i.redd.it/b83am7pzkmo41.jpg ,F,0,2020-03-24 17:49:47
This is the preferred image of my Puppy Golden Retriever,kashiloveu,https://i.redd.it/pbufgllukmo41.jpg ,F,0,2020-03-24 17:49:33
It’s hard doing work with a puppy trying to get on your chrome book,school-causes-autism,https://i.redd.it/cgpeumh0lmo41.jpg ,F,0,2020-03-24 17:49:27
"Izzy, but I sometimes call her Izza-Belly!",SkySongWMass,https://i.redd.it/iwucsfgwkmo41.jpg ,F,0,2020-03-24 17:48:47
Mr. Finn is staying home. Be like Mr. Finn,laceydabunny,https://i.redd.it/1xf21zftkmo41.jpg ,F,0,2020-03-24 17:48:25
5 more minutes 🤨😜,hzulueta,https://i.redd.it/gw1ex1hskmo41.jpg ,F,0,2020-03-24 17:48:10
"It sucks to stay at home and also leftout. My hubby and our kitty are holding hands, hugging, watching movies together... They are the most romantic couple i’ve ever seen...",catgreeneyes,https://i.redd.it/daqomrggkmo41.jpg ,F,0,2020-03-24 17:46:18
My Beagle mix Dana wanted to say hello,StaxxSpark,https://i.redd.it/taf45h7gkmo41.jpg ,F,0,2020-03-24 17:46:16
Midge wants to help me work today,Snowbank_Lake,https://i.redd.it/cyrdo39ekmo41.jpg ,F,0,2020-03-24 17:45:58
WFH Buddy,jinx_younger,https://i.redd.it/plw0pbmakmo41.jpg ,F,0,2020-03-24 17:45:48
Innocent Cat,nursingassignments,https://i.redd.it/6wkcfgb9kmo41.png ,F,0,2020-03-24 17:45:25
guess which puppy is mine,drzilean,https://i.redd.it/lgz40ie5kmo41.jpg ,F,0,2020-03-24 17:44:35
"My new turtle, taken in from a coworker who is moving. Welcome home, Mango!",-_angel_baby_-,https://i.redd.it/x2vhh1p0kmo41.jpg ,F,0,2020-03-24 17:43:50
"Now this just, aww",Pranksterblur,https://i.redd.it/f7b77yarjmo41.jpg ,F,0,2020-03-24 17:42:24
"Found an older shot of one of my cats as a little kitty. Reddit, meet Lady!",AaishaM,https://i.redd.it/jib7ztocjmo41.jpg ,F,0,2020-03-24 17:40:39
"Never owned a cat, know nothing about cats, bought this Maine Coon kitten today, meet Sushi",lughthemage,https://i.redd.it/9s9jeahbjmo41.jpg ,F,0,2020-03-24 17:40:02
New love,Lenz12,https://i.redd.it/oe51wapajmo41.jpg ,F,0,2020-03-24 17:39:54
"So cute, jumping spider [OC]",badbeat4201,https://i.redd.it/84jnveo8jmo41.jpg ,F,0,2020-03-24 17:39:32
When you stay up all night like you’re on vacation but you still have to get up early and work,PPFWalker,https://i.redd.it/d6ot9k6wimo41.jpg ,F,0,2020-03-24 17:37:35
New business attire for their first day reporting to work,Sharp309,https://i.redd.it/b4s0cnmmimo41.jpg ,F,0,2020-03-24 17:36:05
Lil Freckle Belly,redgirrrl,https://i.redd.it/xbn5n3zeimo41.jpg ,F,0,2020-03-24 17:34:56
"One of my good bois, Maxi 💕",IsadoreRae,https://i.redd.it/4uhpzp19imo41.jpg ,F,0,2020-03-24 17:33:57
🔥 Marmot Realises It's Been Caught By A Fox,wostling,https://i.redd.it/9njpkounrlo41.png ,F,0,2020-03-24 17:32:59
food,CL_0,https://i.redd.it/xdtz6j4rhmo41.jpg ,F,0,2020-03-24 17:32:53
"If it fits, it sits!",CharlietheCorgi,https://i.redd.it/huvas2ighmo41.jpg ,F,0,2020-03-24 17:29:32
I filled the balloon half with helium so it suspended in air. Professor was mesmerized.,Neb519,https://i.redd.it/7s4csjn1hmo41.jpg ,F,0,2020-03-24 17:29:01
Just got this small girl home. She fell asleep after 30 minutes of exploring.,Citronfly,https://i.redd.it/54irv43dhmo41.jpg ,F,0,2020-03-24 17:28:58
"Meet Ziva, the sunbathing cat!",ItzDiaz_,https://i.redd.it/uzrqpr5bhmo41.jpg ,F,0,2020-03-24 17:28:52
Was able to capture a poor quality photo of my baby gecko enjoying some mango,justeedo,https://i.redd.it/tu9sp0z6hmo41.jpg ,F,0,2020-03-24 17:28:02
Supervising his quarantine ration delivery.,thatdorkpaul,https://i.redd.it/o06ifuw3hmo41.jpg ,F,0,2020-03-24 17:27:32
Wife sent me this last night. We have no children. His name is Waldon and he’s her baby.,XxSmarTz,https://i.redd.it/f8u26ayzgmo41.png ,F,0,2020-03-24 17:27:08
Touch da beans! Peanut is such a cute old ginger tabby wizard.,watercolorheart,https://i.redd.it/wrjw14rfgmo41.jpg ,F,0,2020-03-24 17:24:06
4 year old girl blows a kiss to her dad through a window,Frankenclyde,https://i.redd.it/taj1q9d0gmo41.jpg ,F,0,2020-03-24 17:21:23
My new friend. Met her while taking a walk and now she follows me everywhere.,lightwithinnature,https://i.redd.it/as8jm5ol6mo41.jpg ,F,0,2020-03-24 17:19:14
Before and after being booped on the snoot,Garciaf8,https://i.redd.it/akhsq6fm4io41.jpg ,F,0,2020-03-24 17:19:04
She's just a pretty lady altogether ❤❤❤,AmoCrustulum,https://i.redd.it/b2a3koc0fmo41.jpg ,F,0,2020-03-24 17:16:36
...and such pretty eyes😍,AmoCrustulum,https://i.redd.it/q8qrljxuemo41.jpg ,F,0,2020-03-24 17:16:13
Nala has a very boopable nose👉❤,AmoCrustulum,https://i.redd.it/pnvqx2qqemo41.jpg ,F,0,2020-03-24 17:16:01
The white-necked rockfowl helped launch Sir David Attenborough's career in 1954 when he produced a new TV series called Zoo Quest. It is among the favorite African birds for ecotourists.,Sayara2020,https://i.redd.it/w6qwkreuemo41.jpg ,F,0,2020-03-24 17:14:55
Suki wondering why her hooman is home all day. She also makes it hard to get any work done.,OK_NO,https://i.redd.it/qmpk2mqwcmo41.jpg ,F,0,2020-03-24 17:13:35
My quarantine buddy,nbridges77,https://i.redd.it/6gwtqe9memo41.jpg ,F,0,2020-03-24 17:13:34
One of her favorite positions to sleep is in the crook of someones neck ❤️,kng_k,https://i.redd.it/l6lffc7kemo41.jpg ,F,0,2020-03-24 17:13:18
Say hello to my Buddy Felix who just turned 18,Wellmyusernamethisis,https://i.redd.it/20grctteemo41.jpg ,F,0,2020-03-24 17:12:26
Drive carefully,berkaydoganpub204,https://i.redd.it/qmttzhl2emo41.jpg ,F,0,2020-03-24 17:10:31
Reddit meet birby she likes to annoy my dad,202018334,https://i.redd.it/u5dunw5wdmo41.jpg ,F,0,2020-03-24 17:09:56
That cute to see how the quarantine effect the cats,stopyou,https://i.redd.it/e1xr1doodmo41.jpg ,F,0,2020-03-24 17:09:47
Some one knows how to quarantine correctly,jwatts117,https://i.redd.it/03xijlcmdmo41.jpg ,F,0,2020-03-24 17:08:00
"""Not sure what we're doing, so I am gonna clap""",ProperEquipment,https://i.redd.it/omd13254dmo41.gif ,F,0,2020-03-24 17:06:07
"I’m on self isolation due to heart problems, my cat Dobby seems to be enjoying more than I am.",apesrevenge,https://i.redd.it/8x54mge7dmo41.jpg ,F,0,2020-03-24 17:05:39
"Reddit say hello to Duke. We adopted him just before the quarantine started, and we couldn’t have asked for better timing.",chalupabatman_,https://i.redd.it/pg4f70ewcmo41.jpg ,F,0,2020-03-24 17:04:11
This dog is living the life...,Trizocbs,https://i.redd.it/kx6blwcqcmo41.jpg ,F,0,2020-03-24 17:03:13
"The goodest of boys turns 9 today. Happy birthday, Hank!",youngcheller,https://i.redd.it/vh8816yncmo41.jpg ,F,0,2020-03-24 17:02:37
Bread made with spent grain used to homebrew oatmeal stout,gavinhudson1,https://i.redd.it/9y5tt44jcmo41.jpg ,F,0,2020-03-24 17:01:56
I would name him spot,ScrollsByNoHowdy,https://i.redd.it/sm4q26uhcmo41.jpg ,F,0,2020-03-24 17:01:40
"Since some random redditor uploaded my picture of my cat sleeping on the dryer the other day, I thought I’d show you what she looked like a few weeks after getting her off the streets in Kuwait. I included progress pictures in the comments",SmockGlarp,https://i.redd.it/559rz94fcmo41.jpg ,F,0,2020-03-24 17:01:18
