NAME,AUTHOR,LINK,T/F,UPVOTES,DATE-TIME
"Working on getting her used to walks, but she's not too keen on them...",NotLikeThis3,https://imgur.com/KbAo7vL ,F,0,2020-03-05 19:52:20
Cute,DatguyDe,https://i.redd.it/bzuoomy4wvk41.jpg ,F,0,2020-03-05 19:51:26
Iz ur feets? I sleeps!,Rastavaray,https://i.redd.it/rv005x20wvk41.jpg ,F,0,2020-03-05 19:50:31
Nice and cozy,Relleomylime,https://i.redd.it/mhefzs1owvk41.jpg ,F,0,2020-03-05 19:54:17
Meet sunny. She’s 15 and this is how she asks for belly rubs,nsepshun,https://i.redd.it/lhp0esanwvk41.jpg ,F,0,2020-03-05 19:54:07
Time for a nap,cegm_,https://i.redd.it/b687nz7lwvk41.jpg ,F,0,2020-03-05 19:53:53
Super cute,Finnishviha,https://i.redd.it/7kdqdjhjwvk41.jpg ,F,0,2020-03-05 19:53:32
"This is the face of a dog who refused to get a butt trim, refused a bath and stole a treat that I had to then pay for. 🤦‍♀️",bazingabear91,https://i.redd.it/psh2dutyvvk41.jpg ,F,0,2020-03-05 19:50:24
"She was sick and he was determined to comfort her no matter how many times I tried to keep them separate, so after they were both sick this is how they sat in our laps (they’ve been to the vet and got medicine so they’re healthy now)",my_driving_moccasins,https://i.redd.it/a17igrstvvk41.jpg ,F,0,2020-03-05 19:49:33
"I mean yes they're ugly, but look at its cute face",ZippoCrew,https://i.redd.it/xgp6ll2cvvk41.jpg ,F,0,2020-03-05 19:46:46
TMW you realize your girlfriend just moved in....,Mission_Ace,https://imgur.com/dHxW5ml ,F,0,2020-03-05 19:46:37
Get off me lawn,FrigidBT,https://i.redd.it/s51qt7mavvk41.jpg ,F,0,2020-03-05 19:46:36
Aww! He is starving after training.,Bishallkc,https://i.redd.it/asmh8mppwvk41.jpg ,F,0,2020-03-05 19:54:33
Saw this cute squirrel at the park (:,bocboc39,https://i.redd.it/9rq83qzowvk41.jpg ,F,0,2020-03-05 19:56:31
I bite all things 😅😅😅,EricViz,https://i.redd.it/pnlyzr27xvk41.jpg ,F,0,2020-03-05 19:57:12
Good place to sleep.. my neighbors cat Wilbur,Qwertymm,https://i.redd.it/9732ggkdxvk41.jpg ,F,0,2020-03-05 19:58:14
Dis my poof ball!,sassybrunette75,https://i.redd.it/izz11dmoyvk41.jpg ,F,0,2020-03-05 20:05:33
Totally A Professional Tennis Player..,Tempus_Blitzii,https://i.redd.it/yhsawcqlyvk41.jpg ,F,0,2020-03-05 20:05:07
Woman reunited with her pupper after 2 years in the military,BauerHouse,https://youtu.be/dMtUAcL23L0 ,F,0,2020-03-05 20:04:06
"“Is that a treat?” (Don’t worry, she got one for holding this pose)",songbird828,https://i.redd.it/e414xv59yvk41.jpg ,F,0,2020-03-05 20:03:23
When nature is bae,NoLookRebona,https://i.redd.it/2ly4gswvxvk41.jpg ,F,0,2020-03-05 20:02:25
My Innocent Caring baby 😍,2sparsh,https://i.redd.it/pktusaztxvk41.jpg ,F,0,2020-03-05 20:01:05
😜,greatlordofcinder,https://i.redd.it/kjea8eguxvk41.jpg ,F,0,2020-03-05 20:00:52
what a thottie,nszajk,https://gfycat.com/rightheftyjabiru ,F,0,2020-03-05 20:00:10
"My little queen of darkness, Maddie!",Museofmelody,https://i.redd.it/6wd5fc3oxvk41.jpg ,F,0,2020-03-05 19:59:53
TUK tuk,ashhutoshpatil,https://i.redd.it/socds5zkxvk41.jpg ,F,0,2020-03-05 19:59:32
They're good friends,tinydino0,https://i.redd.it/63lkcs5wyvk41.jpg ,F,0,2020-03-05 20:06:47
booped,KetchupPackettt,https://i.redd.it/ovhjk73tyvk41.jpg ,F,0,2020-03-05 20:06:27
Just adopted this big boy from the shelter a couple days ago. He's settling right in and is definitely the best of boys. Everyone meet Cody ❤️,nerd15574,https://i.redd.it/1kzay4djxvk41.jpg ,F,0,2020-03-05 19:59:19
Give him the damn nuts,taylor2121,https://v.redd.it/p96lck1azvk41 ,F,0,2020-03-05 20:09:03
He thinks he's a lap dog even though he's ~120 lbs,zooberzaiger,https://i.redd.it/kpuc5gtbzvk41.jpg ,F,0,2020-03-05 20:09:10
Would you believe shes not the mama....dont tell her that though!,hillbillygunz,https://i.redd.it/212rk7u8zvk41.jpg ,F,0,2020-03-05 20:08:41
Indiana Bones,King_Malek,https://i.redd.it/lwaj24i3zvk41.jpg ,F,0,2020-03-05 20:07:51
Rainy days are boring.,spooky46,https://i.redd.it/yby25exlzvk41.jpg ,F,0,2020-03-05 20:10:44
any one interested in a pony (it's not mine but just wondering),Sunnyandbridgey,https://i.redd.it/dhwpobanzvk41.jpg ,F,0,2020-03-05 20:11:00
Another pic of the big boy.. my neighbors cat Wilbur hanging out in the building,Qwertymm,https://i.redd.it/fupbq7ffzvk41.jpg ,F,0,2020-03-05 20:09:45
What he invented again?,kalebderrickjonathan,https://i.redd.it/uhg7yx6kzvk41.jpg ,F,0,2020-03-05 20:11:33
My wife was playing with our baby dinosaur and sent me this 😍,RaunchyBeanBag,https://i.redd.it/88xcbvvruvk41.jpg ,F,0,2020-03-05 19:43:45
Reddit meet my amber eyes black blob,Red_Roses121,https://i.redd.it/zlxhguoquvk41.jpg ,F,0,2020-03-05 19:43:29
This is the day my grandmother passed. My pup loved her and decided that her bed was the perfect spot to sleep,oldbearjack,https://i.redd.it/5i59g9i9uvk41.jpg ,F,0,2020-03-05 19:40:51
Sunbathing next to the window.,skiddlep0p,https://i.redd.it/zlxexdh7uvk41.jpg ,F,0,2020-03-05 19:40:28
Friend picked up some new chicks. Cat decided to adopt them as her own.,andimattone,https://i.redd.it/j7rxp7h5uvk41.jpg ,F,0,2020-03-05 19:40:09
"It's been about a year since we got her, and it's hard to see this shepherd as anything but a goofball",NotYourKindofFluff,https://i.redd.it/v6h7wkn2uvk41.jpg ,F,0,2020-03-05 19:39:45
Momma goat rejected her kid but these kittens think she's just fine!,deadpoetnomore,https://i.redd.it/dew2zlsntvk41.jpg ,F,0,2020-03-05 19:37:25
I guess she had a long day!,shannabastean,https://i.redd.it/qhlp1doktvk41.jpg ,F,0,2020-03-05 19:36:56
Another view of my 14 year old dog on the beach. He’s been with me for most of my life.,SjoerdvDonk,https://i.redd.it/21g0njzftvk41.jpg ,F,0,2020-03-05 19:36:10
"This is moixe, she was a street dog, but now she’s a lap dog who loves sleeping and belly rubs",Official_Nwah,https://i.redd.it/z7lcq23atvk41.jpg ,F,0,2020-03-05 19:35:17
50 shades of grey,berengor_666,https://i.redd.it/9m27dql6tvk41.png ,F,0,2020-03-05 19:35:08
Jack is tired after a long walk!,shoesaretied,https://i.redd.it/gwprrx9osvk41.jpg ,F,0,2020-03-05 19:31:52
"This is Tobey , my best Friend",Lorakboti,https://i.redd.it/x6mfcfresvk41.jpg ,F,0,2020-03-05 19:30:46
evil cat,berengor_666,https://i.redd.it/xkp0sqo4svk41.png ,F,0,2020-03-05 19:29:39
Meet with Malibu-Roadtrip 😜,ulasbelgen,https://i.redd.it/jmxttbx6svk41.jpg ,F,0,2020-03-05 19:29:09
Here is a pic of my cat sleeping.<3,KonKast,https://i.redd.it/o49rfqvsrvk41.jpg ,F,0,2020-03-05 19:27:49
My big fluffball Henry,Smartest_Jacket,https://i.redd.it/zz179d7qrvk41.jpg ,F,0,2020-03-05 19:26:35
Our now 6 1/2 month puppy. The vet has said he is not at all over weight just big boned!,hii-people,https://i.redd.it/mleq6vczbtk41.jpg ,F,0,2020-03-05 19:25:39
Majestic fluff in a beautiful sunset 🌅,OlavMeister,https://i.redd.it/wnzqtox4rvk41.jpg ,F,0,2020-03-05 19:23:14
"Found this small thief stuck in Trashkatraz (my easy to get in, but too high to escape trash bin)",Black_Goreinu,https://i.redd.it/a8fyir8zqvk41.jpg ,F,0,2020-03-05 19:22:27
Keeping me company,Komeoww,https://i.redd.it/45mgakhuqvk41.jpg ,F,0,2020-03-05 19:21:45
I guess father and son bonding happens with dogs aswell.,SpaceBeUberCool,https://i.redd.it/7s3glqdsqvk41.jpg ,F,0,2020-03-05 19:21:18
(another reupload :/) my dog of 7 years old!,RockaSurgeCombo,https://i.redd.it/hsi03wfiqvk41.jpg ,F,0,2020-03-05 19:19:52
Finally got her to choose the bed instead of the floor.,sufthenuf,https://i.redd.it/ikxo8147qvk41.jpg ,F,0,2020-03-05 19:18:12
Her name is Grace and I love her,catsandclavicles,https://i.redd.it/onjp4hd3wuk41.jpg ,F,0,2020-03-05 19:16:52
theres a whole wide world to explore,keatches,https://i.redd.it/ifw3jh1ppvk41.jpg ,F,0,2020-03-05 19:15:50
He's obsessed with his stuffed penguin,picklesforbae,https://i.redd.it/v98t9afrpvk41.jpg ,F,0,2020-03-05 19:15:31
"Meet Zen. He may SEEM innocent and smiley, but he's allllll trouble.",Skrunge13,https://i.redd.it/t6g9pd7cpvk41.jpg ,F,0,2020-03-05 19:15:08
"They protecc, They attacc, But most importantly, They have their brother's bacc.",Kyanite782,https://i.redd.it/2utaz7m3pvk41.jpg ,F,0,2020-03-05 19:11:49
Don’t be fooled. She’s Jekyll and Hyde!,yoda_the_catto,https://i.redd.it/ezp348dxmvk41.jpg ,F,0,2020-03-05 18:59:38
"Every now and then, my dog comes and lays on my lap like this.",fague_doctor,https://i.redd.it/796exp84ovk41.png ,F,0,2020-03-05 19:09:31
They snuggled. My heart exploded.,trybrookemonson11,https://i.redd.it/xdgu8xqhovk41.jpg ,F,0,2020-03-05 19:08:27
Look at this patient 🐬,WizardCash,https://i.redd.it/52x0p6o39wk41.jpg ,F,0,2020-03-05 21:04:00
My sweet girl,Val_1205,https://i.redd.it/lhr7qo819wk41.jpg ,F,0,2020-03-05 21:03:41
Guess who pooped on the carpet today and is very unrepentant? This boye.,MilkPudding,https://i.redd.it/w7h7v6ly8wk41.jpg ,F,0,2020-03-05 21:03:09
1 year later...,Shmandle2k19,https://i.redd.it/dxe3feyt8wk41.jpg ,F,0,2020-03-05 21:02:26
Standing guard for my new little guy,AzizMou,https://i.redd.it/h018hedt8wk41.jpg ,F,0,2020-03-05 21:02:20
Cute paws 😍,zapbob,https://i.redd.it/icnolz7t8wk41.jpg ,F,0,2020-03-05 21:02:19
"My 13 year old shiny poosal cat , everyone still thinks she is a baby , everyone meet Pepsi.",monkeymidd,https://i.redd.it/oicqrpbq8wk41.png ,F,0,2020-03-05 21:01:54
Standing guard for my new little guy,AzizMou,https://i.redd.it/9jinia8p8wk41.jpg ,F,0,2020-03-05 21:01:41
I fed a deer.,not_enough_bananas_,https://i.redd.it/y8ol2rwm8wk41.jpg ,F,0,2020-03-05 21:01:20
“I f’d up” face. If i see this face after work. Somethings been destroyed.,hypocrisyisme,https://i.redd.it/zxbg2p5k8wk41.jpg ,F,0,2020-03-05 21:00:53
Gracie is so bored with this conference call.,vandercampers,https://i.redd.it/1ml9pvxi8wk41.jpg ,F,0,2020-03-05 21:00:45
Meet Moosey. He is a good boy.,MischiefDame,https://i.redd.it/68akg8sg8wk41.jpg ,F,0,2020-03-05 21:00:28
This is Åtte shortly after she was rescued and brought to her forever home!!,iamhappynoodle,https://i.redd.it/jzq8g9i98wk41.jpg ,F,0,2020-03-05 20:59:15
I was at the local zoo last year and captured this aww moment between two big kitties.,OTwhattheF,https://i.redd.it/waae0wjv7wk41.jpg ,F,0,2020-03-05 20:59:13
cat in a store (outside),HumanTR,https://i.redd.it/bpfngoj38wk41.jpg ,F,0,2020-03-05 20:58:24
Little bandit,TicTockTheTicClock,https://i.redd.it/8vr0kbyz7wk41.jpg ,F,0,2020-03-05 20:57:48
Triton waiting for his first vet appt.,kvndreth,https://i.redd.it/up1hngkt7wk41.jpg ,F,0,2020-03-05 20:56:53
Vogue status,lblume-,https://i.redd.it/nzxlb5lo7wk41.jpg ,F,0,2020-03-05 20:55:58
When you’re so sleepy you lose your neck.,KickAssKyleB,https://i.redd.it/c6ukxge77wk41.jpg ,F,0,2020-03-05 20:53:29
I visited a litter a while ago on a farm a while ago. This guy was my favourite.,Joseph_Stalin44,https://i.redd.it/rn0h7nb87wk41.jpg ,F,0,2020-03-05 20:53:28
Sweet 😊,Rujbinylmaz,https://i.redd.it/oi9fw0ut6wk41.jpg ,F,0,2020-03-05 20:51:11
box full of aww,DaV1se,https://i.redd.it/avwyqosl6wk41.jpg ,F,0,2020-03-05 20:50:37
The dogs soaking up the last rays of a gorgeous day.,Ommadons_Bryagh,https://i.redd.it/q9j4p49h6wk41.jpg ,F,0,2020-03-05 20:49:17
"He was barking at the door so I went to check if someone was there, turns out I’d been bamboozled and lost my seat",lazzypete,https://i.redd.it/l4xitq4b6wk41.jpg ,F,0,2020-03-05 20:48:20
Could not find my cat.,Mr-TonyX,https://i.redd.it/p8j1hpl46wk41.jpg ,F,0,2020-03-05 20:47:16
Doggo hard at work,Cameaton,https://i.redd.it/xwajlty26wk41.jpg ,F,0,2020-03-05 20:47:02
Just a pup and his ball,DisappointingMartyr,https://i.redd.it/51yzwx3y5wk41.jpg ,F,0,2020-03-05 20:46:22
Daisy doo i bloop you too lol,katieleigh2888,https://i.redd.it/qzfuk3au5wk41.jpg ,F,0,2020-03-05 20:45:40
When you pick a partner before you can even see them,felinecustard,https://i.redd.it/tb5mj8go5wk41.jpg ,F,0,2020-03-05 20:45:16
Double Trouble,TheAppleFigNewton,https://i.redd.it/e4lnt1hb5wk41.jpg ,F,0,2020-03-05 20:42:46
"Walruses snuggling on Walrus Island, Nunavut, Canada (oc)",ItsALadder,https://i.redd.it/6tu7s2ha5wk41.jpg ,F,0,2020-03-05 20:42:33
I’m a sucker for flappy ears 🤦🏾‍♂️😂,MajTheAlmighty,https://i.redd.it/rm5lmzx75wk41.jpg ,F,0,2020-03-05 20:42:12
Just got back from the vet!!,theprofessionalbruh,https://i.redd.it/fvdn2pdx4wk41.jpg ,F,0,2020-03-05 20:40:32
These babies sparked so much joy!!,uiomzn,https://i.redd.it/ua7mge1i4wk41.png ,F,0,2020-03-05 20:40:18
My cutie is helping me to work while I'm at home,ZweiSolomon,https://i.redd.it/f373cnat4wk41.jpg ,F,0,2020-03-05 20:39:56
One floof on a swing❤,Jack___Beard,https://i.redd.it/24gmc4ir4wk41.gif ,F,0,2020-03-05 20:39:43
It's my cake day y'all. It's my cake day.,justAcuriousDalek,https://i.redd.it/p2fid5jq4wk41.jpg ,F,0,2020-03-05 20:39:27
TBT to those puppy days <3,Any_Lemon,https://i.redd.it/jd539mx34wk41.jpg ,F,0,2020-03-05 20:38:06
My dad's doggo and kitten,toaster_express,https://i.redd.it/fl5v60wa4wk41.jpg ,F,0,2020-03-05 20:37:04
Dreaming of the future,wolfpack1004,https://i.redd.it/b60fr3094wk41.jpg ,F,0,2020-03-05 20:36:46
This llama’s smile after we fed him on a zoofari,AnitaXanaxx,https://i.redd.it/noyese9w3wk41.jpg ,F,0,2020-03-05 20:34:46
A little #puppy in need of a hug! Send him your hug! Smiling face with open mouth,Raqasa_veng,https://i.redd.it/s9msnfwt3wk41.jpg ,F,0,2020-03-05 20:34:37
Meet my new kitty Katnis! Adopted her 3 days ago.,Daitoshen,https://i.redd.it/69ghuh0s3wk41.jpg ,F,0,2020-03-05 20:34:06
My wife snuggling our cat snuggling his stuffed puppy.,Nstep49,https://i.redd.it/r1a53ua73wk41.jpg ,F,0,2020-03-05 20:30:58
Jules decided to interrupt my photoshoot today so I gave him the fabulous edit he deserved.,unitedfakesofamerica,https://i.redd.it/0umtmbv13wk41.jpg ,F,0,2020-03-05 20:30:01
Martha & her shadow on this sunny Thursday in Toronto.,Raqasa_veng,https://i.redd.it/fgsqgv0t2wk41.jpg ,F,0,2020-03-05 20:28:52
This is a Pose He Chose ...So Cute!!,asmatasmat784,https://i.redd.it/iuejlk5q2wk41.jpg ,F,0,2020-03-05 20:28:13
He’s got the whole world in his paws,angelicareeves,https://i.redd.it/etr6ounj2wk41.jpg ,F,0,2020-03-05 20:27:11
Now how am I supposed to do my bed?,Nickname2088,https://i.redd.it/ws97b1zc2wk41.jpg ,F,0,2020-03-05 20:26:10
Tiny chuckers like bananas. Who knew?,beezeebeehazcatz,https://i.redd.it/nzya29292wk41.jpg ,F,0,2020-03-05 20:25:33
"This is Charlie, a 6 month old Ragdoll and a very good boy",greavesyman,https://i.redd.it/zedbvacy1wk41.jpg ,F,0,2020-03-05 20:23:53
Wild flufferbun napping it up,aarontminded,https://i.redd.it/a7whqasx1wk41.jpg ,F,0,2020-03-05 20:23:49
Comment on a scale from 1-10 how much you like cows,Sunnyandbridgey,https://i.redd.it/likxv07n1wk41.jpg ,F,0,2020-03-05 20:23:12
My cat is still unsure about the dog.,Clearlynotchocolate,https://i.redd.it/9ep94c0l1wk41.jpg ,F,0,2020-03-05 20:21:47
Meet Kash,AyoSD,https://i.redd.it/8lcb4x1f1wk41.jpg ,F,0,2020-03-05 20:20:53
Taking a mid-hike pause to snuggle with the best little buddy I’ve ever had,AmeliaStrong,https://i.redd.it/yqgvh6fd1wk41.jpg ,F,0,2020-03-05 20:20:40
My Sweet Zelda,LuxCaritas,https://i.redd.it/wqzt5wd61wk41.jpg ,F,0,2020-03-05 20:19:30
Kitty had a rough night of waking me up every hour... so tired.,Kimi4201,https://i.redd.it/lo964sz41wk41.jpg ,F,0,2020-03-05 20:19:21
Bonding!,missionwonderwoman,https://i.redd.it/o3w99n4u0wk41.jpg ,F,0,2020-03-05 20:17:36
This Goose all Cuddled Up on the Sidewalk,mistcurve,https://i.redd.it/howyh70p0wk41.jpg ,F,0,2020-03-05 20:16:49
Your reaction when you hear a noise in the middle of a scary movie...,Janinefhas,https://i.redd.it/raeg7q15tvk41.jpg ,F,0,2020-03-05 20:16:28
My old lady,Radvaldur,https://i.redd.it/dxaz7p690wk41.jpg ,F,0,2020-03-05 20:14:21
Look at that cheeky face!,vrncgn,https://i.redd.it/q1s1qo480wk41.jpg ,F,0,2020-03-05 20:14:19
My baby,YeetTheater,https://i.redd.it/a4bkun0k9wk41.jpg ,F,0,2020-03-05 21:06:31
I r book now,DrizN,https://i.redd.it/jlfmdl9r3xk41.jpg ,F,0,2020-03-05 23:55:56
My best girl,heckin-spice-boy,https://i.redd.it/frr982qa3xk41.jpg ,F,0,2020-03-05 23:53:14
Hows my new baby looking?!?! Meet Luci-Furr! Shes a lab/Shepard rescue!,tyrosared,https://i.redd.it/puyvpun13xk41.jpg ,F,0,2020-03-05 23:51:47
we just got this beautiful Akita puppy! very excited to welcome him to our family.,tropicanicc,https://i.redd.it/o0z9x9bj2xk41.jpg ,F,0,2020-03-05 23:48:56
Why can’t I get someone to look at me the same way my puppy does,hackeysackey,https://i.redd.it/n3a3fey92xk41.jpg ,F,0,2020-03-05 23:47:30
Photobomb,MrSchnapskatze,https://i.redd.it/k7vscxq42xk41.jpg ,F,0,2020-03-05 23:46:56
New arrivals to the household from Mimi's first litter!,DatOreoBoi,https://i.redd.it/3x1xhkmx1xk41.jpg ,F,0,2020-03-05 23:45:32
"Luna, the dumbest, most cuddly kitty I know",SuperDucky16,https://i.redd.it/qpygnixp1xk41.jpg ,F,0,2020-03-05 23:44:20
This tiny orange in my orange,Georginaemily,https://i.redd.it/rt534tdg1xk41.jpg ,F,0,2020-03-05 23:43:23
My pup on his very first birthday,Brockcp13,https://i.redd.it/sjhcfpof1xk41.jpg ,F,0,2020-03-05 23:42:46
My freckle face boy.,ivie96,https://i.redd.it/60n1qb5d1xk41.jpg ,F,0,2020-03-05 23:42:25
Blankies are my happy place,cheychey9983,https://i.redd.it/o3pu3uj71xk41.jpg ,F,0,2020-03-05 23:41:30
Brother&sister ❤ I'm not sure what there waiting for they just been fed maybe it's my Turkey sandwich 🦃 (which they'll probably some aswell),Jack___Beard,https://i.redd.it/gbtxffb51xk41.jpg ,F,0,2020-03-05 23:41:23
My cat when he was a bwayby,Its_K3,https://i.redd.it/hjqamkf41xk41.png ,F,0,2020-03-05 23:41:00
“Yes I’ll have 0.1 mm off the top.”,blueees,https://i.redd.it/40tptdmv0xk41.jpg ,F,0,2020-03-05 23:39:37
"I’m a pretty high strung dude, it’s good to have someone in the house to balance it out.",drumandbass01,https://i.redd.it/to7j10jj0xk41.jpg ,F,0,2020-03-05 23:37:44
My thin cat's life is hard,cooblat,https://i.redd.it/gv38133a0xk41.jpg ,F,0,2020-03-05 23:36:55
Free shipping under 11 pounds,abrahamhitler,https://i.redd.it/rdrjmmc60xk41.jpg ,F,0,2020-03-05 23:35:46
Very comfortable don't you think,Legolad1310,https://i.redd.it/uax1h50qzwk41.jpg ,F,0,2020-03-05 23:33:08
"Twirly was rescued from under a pile of planks. He is courageous, friendly and a bit of troublemaker.",Jeedras,https://i.redd.it/x1kzit90zwk41.jpg ,F,0,2020-03-05 23:29:28
let me take a nap right here,keatches,https://i.redd.it/kj7zropzywk41.jpg ,F,0,2020-03-05 23:29:11
a picture with my cat #4,blackadrian,https://i.redd.it/8ton74bnywk41.jpg ,F,0,2020-03-05 23:27:11
My pup thinks our neighbor's dog is her baby,Ksrugi,https://i.redd.it/v7job9dyxwk41.jpg ,F,0,2020-03-05 23:23:15
Isn't he cute?,CommFlaek,https://i.redd.it/yc80lqrsxwk41.jpg ,F,0,2020-03-05 23:22:44
I tidied my desk and the cat thinks it was for her,Charlie00134,https://i.redd.it/gfnzinlqxwk41.jpg ,F,0,2020-03-05 23:22:06
What other animals does this dog look like,ryRPG21,https://i.redd.it/1ubn1m3oxwk41.jpg ,F,0,2020-03-05 23:21:41
My cousin got a puppy! This lil boy's name is Leo.,rae_is_rad,https://i.redd.it/z8h9vg3jxwk41.jpg ,F,0,2020-03-05 23:20:52
Smol shopping helper,uselessbutuseful,https://i.redd.it/tb61sl4dxwk41.jpg ,F,0,2020-03-05 23:19:55
"Calvin the Doxador's dumb ears have set in place like this-- as a little girl at the park said, ""He's got one ear up and one ear floppy!""",Wollastons,https://i.redd.it/kk3dglp2xwk41.jpg ,F,0,2020-03-05 23:19:38
My drawing of a Redditors drawing of a Redditors painting of a Redditors pup. I really enjoyed drawing this one.,cottage_cheese_WeaVe,https://i.redd.it/hv14y2v9xwk41.jpg ,F,0,2020-03-05 23:19:27
Here is my handsome man Jimmy Dean,Imhappyeveryday,https://i.redd.it/h60cq4g6xwk41.jpg ,F,0,2020-03-05 23:18:58
"Excuse me, could I have just a little bit of that food?",Jay3000X,https://i.redd.it/5ramrmdvwwk41.jpg ,F,0,2020-03-05 23:17:13
first post ever im on mobile but i wanted to post on my b day so heres a cat.took the pic on my phone so yea,onefinishguy,https://i.redd.it/v5l9a2luwwk41.jpg ,F,0,2020-03-05 23:17:06
Officer K waiting for belly rubs,BrokenAvacado,https://i.redd.it/msglpjgqwwk41.jpg ,F,0,2020-03-05 23:16:31
Sleeping Angel 😇 & Tiny Monster Auggie the puppy enigma,ellelunden,https://i.redd.it/gl1q5gdnwwk41.jpg ,F,0,2020-03-05 23:15:57
My dog keeps begging for food. Every time I sit down with a plate or bowl she does this.,GrapeWay,https://i.redd.it/c6gernfhwwk41.jpg ,F,0,2020-03-05 23:15:02
Fell asleep right on my lap,redditaccount2002,https://i.redd.it/3h2ynhjewwk41.jpg ,F,0,2020-03-05 23:14:32
Early morning sun 1,jhodendaal,https://i.redd.it/zn6561ydwwk41.jpg ,F,0,2020-03-05 23:14:27
Sleepy Girl,UpVotieGirll,https://i.redd.it/dgxbrvbdwwk41.jpg ,F,0,2020-03-05 23:14:22
My boy Fletcher greeting me on a return from a walk.,jackjakc,https://i.redd.it/elnrvjk6iuk41.jpg ,F,0,2020-03-05 23:14:18
Early morning sun 1,jhodendaal,https://i.redd.it/lftscofcwwk41.jpg ,F,0,2020-03-05 23:14:13
Early morning sun,jhodendaal,https://i.redd.it/az19neacwwk41.jpg ,F,0,2020-03-05 23:14:12
Thirsty girl.,pof0808,https://i.redd.it/su07syz7wwk41.jpg ,F,0,2020-03-05 23:13:31
All snug and happy,stuka55,https://i.redd.it/q4b37vj7wwk41.jpg ,F,0,2020-03-05 23:13:26
My pup,Zee1837,https://i.redd.it/cnztonavvwk41.jpg ,F,0,2020-03-05 23:13:15
Totoro! I It’s kinda early so probs not his best photo.,hii-people,https://i.redd.it/9khsy2o0luk41.jpg ,F,0,2020-03-05 23:12:34
“I gots the edumacations mommy”,londrakittykat,https://i.redd.it/iclcpf6mvwk41.jpg ,F,0,2020-03-05 23:10:09
My lil Ronnie baba,ligma-big-booty-bru,https://i.redd.it/3rbdolgjvwk41.jpg ,F,0,2020-03-05 23:09:43
My drawing of a redditors oil painting of a redditors pup. I really enjoyed drawing this one,humzakhantx2,https://i.redd.it/8e8j1qpgvwk41.jpg ,F,0,2020-03-05 23:09:16
Here’s my step-father and my lil’ Doggo kayaking 🐶🚣🏼‍♀️💕,RiipeR-LG,https://i.redd.it/6tx0kxjavwk41.jpg ,F,0,2020-03-05 23:08:19
Mr. Doggo not feeling good.,theprofessionalbruh,https://i.redd.it/bmqbqs43vwk41.jpg ,F,0,2020-03-05 23:07:18
"Hey mom, it looks like you're trying to write your dissertation. It'd be a shame if someone....was lying on your computer",NewtBanker,https://i.redd.it/t7ywaccxuwk41.jpg ,F,0,2020-03-05 23:06:15
"Here are my two cats, just after this photo they fought together, if you have advice to calm them down",The_Coolest_Sheep,https://i.redd.it/3gm32prruwk41.jpg ,F,0,2020-03-05 23:05:24
A baby Coquerel's sifaka at the Los Angeles Zoo,the_osc_ocelot,https://i.redd.it/zxx569tmuwk41.jpg ,F,0,2020-03-05 23:05:20
He didn't like the ribbon so we tried flowers — big improvement on the reactions so far,catnip1802,https://i.redd.it/27twahtguwk41.jpg ,F,0,2020-03-05 23:04:31
Sabrina is too grumpy to get up,LifeisStillGone,https://i.redd.it/ityw3f5iuwk41.jpg ,F,0,2020-03-05 23:03:57
The void likes to have her paw held when it's nap time,Shankytang,https://i.redd.it/mm35u1gfuwk41.jpg ,F,0,2020-03-05 23:03:33
Happy Floof! 😍,rehlingenn,https://i.redd.it/tis948r0uwk41.jpg ,F,0,2020-03-05 23:01:10
business dog,Extra-Coyote,https://i.redd.it/5aho2e3ttwk41.jpg ,F,0,2020-03-05 23:00:03
My pup sticks his whole head in the bowl when going for a drink of water,BeardoDragon,https://i.redd.it/xs45f44otwk41.jpg ,F,0,2020-03-05 22:59:14
High five,tonka_my_dog,https://i.redd.it/emcq0wgltwk41.jpg ,F,0,2020-03-05 22:58:57
Tiny PS4 kit,WhydYouEvenDoThat,https://i.redd.it/xev28wxjtwk41.jpg ,F,0,2020-03-05 22:58:37
"This is Luna, my 4mo Corgi pup.",RonnyCrawf,https://i.redd.it/vawfqppftwk41.jpg ,F,0,2020-03-05 22:57:55
A happy Daisy in her favorite spot (that wasn’t next to her people),iamhappynoodle,https://i.redd.it/g8yvhj2ctwk41.jpg ,F,0,2020-03-05 22:57:21
😍,RaunchyBeanBag,https://i.redd.it/jy18aopatwk41.jpg ,F,0,2020-03-05 22:57:08
This cutie who aligned their paws just for us,uio7n,https://i.redd.it/x8ij1ld6twk41.png ,F,0,2020-03-05 22:56:41
He can be photogenic sometimes,necrid417,https://i.redd.it/b7ttsde6twk41.jpg ,F,0,2020-03-05 22:56:29
"Come play with me, mommy!",vanillacraic,https://i.redd.it/kxxuxq82twk41.jpg ,F,0,2020-03-05 22:55:48
My dog at Christmas time 🥰,_killer_queen_04_,https://i.redd.it/qgagzhr1twk41.jpg ,F,0,2020-03-05 22:55:45
heroic cat,WattyTotty,https://i.redd.it/b0jvbnbzswk41.jpg ,F,0,2020-03-05 22:55:21
Having a snooze,geezusus,https://i.redd.it/j7cjxilxswk41.jpg ,F,0,2020-03-05 22:55:08
My cat in his fortress,car-man1234,https://i.redd.it/3cnpwnowswk41.jpg ,F,0,2020-03-05 22:54:58
"My friend pup, He wants me to pet him. He is such a good pup!!",Black_feather_2020,https://i.redd.it/u4ofx7prswk41.jpg ,F,0,2020-03-05 22:54:13
My dormouse cat,Rexel79,https://i.redd.it/bvenistqswk41.jpg ,F,0,2020-03-05 22:54:04
ruff ruff,jrauli,https://i.redd.it/bnkyjh0oswk41.jpg ,F,0,2020-03-05 22:53:52
Sweet child of mine watching over her kingdom.,Garathorshadow,https://i.redd.it/p20y0eh36xk41.jpg ,F,0,2020-03-06 00:08:55
Dudley getting cuddly,Acornknight,https://i.redd.it/ett0g2106xk41.jpg ,F,0,2020-03-06 00:08:41
Are you the sweetest babies in the world?,canakyuz,https://i.redd.it/ekj6ulzr5xk41.jpg ,F,0,2020-03-06 00:07:39
My 16 year old kitty 6 days post surgery. I’m so happy she’s feeling better. ❤️,woahmost,https://i.redd.it/zk34p8pu5xk41.jpg ,F,0,2020-03-06 00:07:36
Jack likes to hang out in bed with us,skdiddy,https://i.redd.it/6e5hlfmu5xk41.jpg ,F,0,2020-03-06 00:07:33
Its his foot now,ipoopondogs69,https://i.redd.it/d62ooyrp5xk41.jpg ,F,0,2020-03-06 00:06:46
Woof,joemama16839301,https://i.redd.it/lxc9m7fh5xk41.jpg ,F,0,2020-03-06 00:05:28
Everytime I start doing my homework my cat does this...,edga_games,https://i.redd.it/6ozopa485xk41.jpg ,F,0,2020-03-06 00:04:33
Smol boop,areichart,https://i.redd.it/l0wyjtn95xk41.jpg ,F,0,2020-03-06 00:04:13
They're so cute!! I want cats like those 2!,raweza,https://i.redd.it/5pbt06875xk41.jpg ,F,0,2020-03-06 00:03:50
