NAME,AUTHOR,LINK,T/F,UPVOTES,DATE-TIME
Say hi to my best friend bean :D,-zedx-,https://i.redd.it/z6miwhmv7ap41.jpg ,F,0,2020-03-28 01:18:39
A little sleepy,flamefightr,https://i.redd.it/wefm04iq7ap41.jpg ,F,0,2020-03-28 01:17:48
Sleepy eyes :)),smashedpears,https://i.redd.it/o2idcpyp7ap41.jpg ,F,0,2020-03-28 01:17:43
My dog thinks it's a Sphinx,scottjay86,https://i.redd.it/ji1eo7ie7ap41.jpg ,F,0,2020-03-28 01:15:55
Very Tuff Time to survive outside Keep yourself inside and safe,rahulshuklaynr750,https://i.redd.it/qd1ivtk37ap41.jpg ,F,0,2020-03-28 01:15:10
Found this doge dodging traffic today,brittinea,https://i.redd.it/mpceayo47ap41.jpg ,F,0,2020-03-28 01:14:45
Black and tan doggo named Nori,pepperedsalami,https://i.redd.it/lgdt60137ap41.jpg ,F,0,2020-03-28 01:14:08
How do we feel about goats?,madmansmarker,https://i.redd.it/4jus8p1v6ap41.jpg ,F,0,2020-03-28 01:12:51
I thought my cat was looking cute,sloppychip131,https://i.redd.it/96x3w1go6ap41.jpg ,F,0,2020-03-28 01:11:52
My beautiful girl. She’s 6 years old but still my puppy,StapleEm43,https://i.redd.it/civ76e0l6ap41.jpg ,F,0,2020-03-28 01:11:18
"Stop working, it's cuddle time!!",waluigihellathicc,https://i.redd.it/s2dvmn2j6ap41.jpg ,F,0,2020-03-28 01:10:59
"7 month old and teething, gorgeous eyes",0sc24,https://i.redd.it/858fo1u96ap41.jpg ,F,0,2020-03-28 01:09:35
My cat sleeping,IReallyDontMakeSense,https://i.redd.it/jtqbdyn76ap41.jpg ,F,0,2020-03-28 01:09:14
Peep his stalker in the back,daisylover123,https://i.redd.it/9zbluty56ap41.jpg ,F,0,2020-03-28 01:08:58
"March 27, 2020",TheLifeOfBisk,https://i.redd.it/my2pbt616ap41.jpg ,F,0,2020-03-28 01:08:41
Some coworkers have no consideration of personal space,mustangel,https://i.redd.it/dudzdn026ap41.jpg ,F,0,2020-03-28 01:08:22
"She waits outside of the kitchen, as if I don't see her watching my sandwich.",i8mygoldfish,https://i.redd.it/2km9tjp06ap41.jpg ,F,0,2020-03-28 01:08:08
Just wanted to share a picture of my (tired) rabbit,aachenwillrise,https://i.redd.it/ngjmpfys5ap41.jpg ,F,0,2020-03-28 01:07:06
The majestic Chandler,MtheUnknown,https://i.redd.it/flg23j5q5ap41.jpg ,F,0,2020-03-28 01:06:35
Just a couple of best friends,Chops2917,https://i.redd.it/50tp6ndk5ap41.jpg ,F,0,2020-03-28 01:05:36
"Scented candles, a movie and cuddling with this cutie",katelli,https://i.redd.it/oj2km6re5ap41.jpg ,F,0,2020-03-28 01:05:25
My bird has been super happy about quarantine since everybody’s home!,super_hoommen,https://i.redd.it/f9xo6jfg5ap41.jpg ,F,0,2020-03-28 01:04:59
My baby helping out in family game night,ijustatesubway,https://i.redd.it/rmve1bef5ap41.jpg ,F,0,2020-03-28 01:04:48
"Found this little fella in the woods by my house. Everybody, meet Gerald the garter snake.",KevinJCarroll,https://i.redd.it/8zybx9p85ap41.jpg ,F,0,2020-03-28 01:03:50
We have plenty of rolls!,ridracer09,https://i.redd.it/ay5cisz55ap41.jpg ,F,0,2020-03-28 01:03:21
Daily smile from Bandit the Keeshond,lastchancelast,https://i.redd.it/41nnkd2z4ap41.jpg ,F,0,2020-03-28 01:02:32
Stop seeing covid-19 stuff and look at my sleeping cat,awsomebigboi,https://i.redd.it/g5jgo1wx4ap41.jpg ,F,0,2020-03-28 01:02:09
Man hand vs Eagle talon,Caro2018,https://i.redd.it/l404myzw4ap41.jpg ,F,0,2020-03-28 01:01:56
Catitude,emdess8578,https://i.redd.it/7ew6u4zt4ap41.jpg ,F,0,2020-03-28 01:01:33
My lil hound dog pup likes to be heard!,nativeguideok,https://i.redd.it/mg3szt2u4ap41.jpg ,F,0,2020-03-28 01:01:33
Halo thear good peoples,pupsaurus,https://i.redd.it/mj7lmmba4ap41.jpg ,F,0,2020-03-28 01:01:22
"A little golden doglet, sat in the wind.",Clairejune09,https://i.redd.it/9vf9xqzf4ap41.jpg ,F,0,2020-03-28 01:00:54
Not what it looks like bro.,Seaweedad0,https://i.redd.it/y01s29if4ap41.jpg ,F,0,2020-03-28 00:59:15
Our big boy looking handsome,H_P_Swolecraft,https://i.redd.it/d1zi6j994ap41.jpg ,F,0,2020-03-28 00:58:33
I am hungry!,abidhussain11,https://i.redd.it/xautmc4w3ap41.jpg ,F,0,2020-03-28 00:56:19
Hello darkness my old friend,thatcatsheldon,https://i.redd.it/stcgkqzq3ap41.jpg ,F,0,2020-03-28 00:55:25
Just saw these two boys outside my window. First time posting here,Rexamidalion,https://i.redd.it/t8b9t77n3ap41.jpg ,F,0,2020-03-28 00:54:53
I just got a new loft bed and I think the cats are going to steal it lol.,CaptainJaker100,https://i.redd.it/nxxbjsvl3ap41.jpg ,F,0,2020-03-28 00:54:48
Did my dog just meme?,PippaThePig,https://i.redd.it/tfp3ndmh3ap41.jpg ,F,0,2020-03-28 00:54:12
10 years apart,vladgrinch,https://i.redd.it/gphswj9f3ap41.png ,F,0,2020-03-28 00:53:49
Puppy pawws.,rubberguard83,https://i.redd.it/shq4kca63ap41.png ,F,0,2020-03-28 00:52:34
The perfect shot,MilkiesCat,https://i.redd.it/vchppy513ap41.jpg ,F,0,2020-03-28 00:51:29
Enjoying the sun before 5 days of forecasted rain.,Cichlidsaremyjam,https://i.redd.it/7gtk1p303ap41.jpg ,F,0,2020-03-28 00:51:14
Bella is the most ”inside” dog I’ve ever been around.,bassthumb32,https://i.redd.it/i6up4oru2ap41.jpg ,F,0,2020-03-28 00:50:34
I like turtles,mikeockiselongated,https://i.redd.it/ar02ctdv2ap41.jpg ,F,0,2020-03-28 00:50:31
"Self-isolated kitty, Poppy",sarcasticfonts,https://i.redd.it/qviv0gvc2ap41.jpg ,F,0,2020-03-28 00:47:38
Found this little guy in my backyard!,Isodorf,https://i.redd.it/sqbl1mrb2ap41.jpg ,F,0,2020-03-28 00:47:28
I took a picture of my cat winking,okopek,https://i.redd.it/0dc7tkdr1ap41.jpg ,F,0,2020-03-28 00:44:16
"Loyal, old boy",mclayson,https://i.redd.it/w97m6ytk1ap41.jpg ,F,0,2020-03-28 00:43:19
What do you mean we are out of catnip,CaseyandBea,https://i.redd.it/gd1tav8h1ap41.jpg ,F,0,2020-03-28 00:42:49
My big boy likes to “hide” when it’s time to leave the park,sharkee1,https://i.redd.it/vrgu6spg1ap41.jpg ,F,0,2020-03-28 00:42:39
My Quarantine Buddies!,Miesel,https://i.redd.it/1amxbg4ql9p41.jpg ,F,0,2020-03-28 00:41:34
Sniffing out the longroad ahead of us,Dandelosrados,https://i.redd.it/416x5ql71ap41.jpg ,F,0,2020-03-28 00:41:16
I was sitting on her favourite couch - she wasn't pleased.,frizzybunny,https://i.redd.it/d6kohhv41ap41.png ,F,0,2020-03-28 00:41:05
Not mine but found it floating in my gallery.,mikeockiselongated,https://i.redd.it/kry2kjsx0ap41.jpg ,F,0,2020-03-28 00:39:40
She certainly isn’t complaining about the shelter in place! Thankful to be able to spend more time with the pups while staying safe WFH.,daisylover123,https://i.redd.it/ibt79rls0ap41.jpg ,F,0,2020-03-28 00:38:53
Most dedicated worker I've seen in my entire life,Longjumping-Contest,https://i.redd.it/01v0jmio0ap41.gif ,F,0,2020-03-28 00:38:19
I asked them to make a cute heart. They... tried their best.,perfect_fifth_note,https://i.redd.it/4jh558in0ap41.jpg ,F,0,2020-03-28 00:38:09
Both ham sandwiches taking naps in the sun,PriceIsWrongB0b,https://i.redd.it/iln3tuve0ap41.jpg ,F,0,2020-03-28 00:36:42
Every.... day....,nottodvysvtvn,https://i.redd.it/dh1komd80ap41.jpg ,F,0,2020-03-28 00:35:42
Everybody meet Clara!,bookwithnowords,https://i.redd.it/deu18ak50ap41.jpg ,F,0,2020-03-28 00:35:18
"Working from home, decided to photograph my dog basking in the sun!",DeadYen,https://i.redd.it/ipyfxe420ap41.jpg ,F,0,2020-03-28 00:34:45
Today Gus learnt he could jump in the flower boxes and proceeded to dig up the flowers,coffeeinthehole_,https://i.redd.it/jv3yesqzz9p41.jpg ,F,0,2020-03-28 00:34:21
This is an everyday occurance...,Nikki1_2_3,https://i.redd.it/ewbiua4lz9p41.jpg ,F,0,2020-03-28 00:32:08
Smol bean gets a bath,diveonfire,https://i.redd.it/p5stp1skz9p41.jpg ,F,0,2020-03-28 00:32:02
My brother and our dog,nuysance,https://i.redd.it/j79hztgxy9p41.jpg ,F,0,2020-03-28 00:28:24
She melt,mttya2,https://i.redd.it/lou76yiuy9p41.jpg ,F,0,2020-03-28 00:28:01
My fluffy boi,Chamathknz,https://i.redd.it/cy6scprty9p41.jpg ,F,0,2020-03-28 00:27:53
Happy Zayda Buggles.,SpagooterCooter,https://i.redd.it/4s93c3fpy9p41.jpg ,F,0,2020-03-28 00:27:10
Need sticks removed from your yard? These are your guys. A+ workers. Would recommend.,wolfxblood,https://i.redd.it/tqaz0ouhy9p41.jpg ,F,0,2020-03-28 00:25:58
My beefy boy taking a nap during the quarantine,PriceIsWrongB0b,https://i.redd.it/qsnegbagy9p41.jpg ,F,0,2020-03-28 00:25:43
Instagram vs Reality,SJSchultz,https://i.redd.it/yqihoc0gy9p41.jpg ,F,0,2020-03-28 00:25:41
Puppy’s Camouflage is Working,Seal4303,https://i.redd.it/o1hjg1ney9p41.jpg ,F,0,2020-03-28 00:25:30
Today is a great day for napping.,Fraziek01,https://i.redd.it/dryp3jyay9p41.jpg ,F,0,2020-03-28 00:24:55
Caught my cat while she was cleaning herself,doyouknowthealphabet,https://i.redd.it/750vu9e7y9p41.jpg ,F,0,2020-03-28 00:24:27
10 weeks old and her tail is starting to turn a grey/white,Googleitt_,https://i.redd.it/bwlje4lxx9p41.jpg ,F,0,2020-03-28 00:22:51
"Absorb the cuteness of this basketcase, Skunkeroo. Its so hard to get a good photo of him.",SpagooterCooter,https://i.redd.it/wiuej9axx9p41.jpg ,F,0,2020-03-28 00:22:47
When he’s been waiting longer than normal for me to come home.,OlympianFlowers,https://i.redd.it/bgsb86xtx9p41.jpg ,F,0,2020-03-28 00:22:13
Rocky just came back from the groomer smelling fresh and clean :),The-Timbo,https://i.redd.it/ytjgkesqx9p41.jpg ,F,0,2020-03-28 00:21:46
My supervisor has issues with my work performance.,Lexi_Banner,https://i.redd.it/usioi7ukx9p41.jpg ,F,0,2020-03-28 00:21:16
"Saw the “cat sneeze” photo, so I figured I’d post mine.",pizzamaaaaaan,https://i.redd.it/rvxps26mx9p41.jpg ,F,0,2020-03-28 00:21:07
my cat sleeping. he’s adorable,thewizardof-OZ,https://i.redd.it/ucpo3cvkx9p41.jpg ,F,0,2020-03-28 00:20:50
My parents' tri-colour collie. He is a handful but knows how to chill,thanasaurus-rex,https://i.redd.it/ztpz9lsjx9p41.jpg ,F,0,2020-03-28 00:20:39
Anyone else's dog lay like this?,K_Its_Not_Original,https://i.redd.it/ewtnjmfjx9p41.jpg ,F,0,2020-03-28 00:20:36
Snuggles with this guy,SuperSaiyan1-2-3-4,https://i.redd.it/i3cfnh8ax9p41.jpg ,F,0,2020-03-28 00:19:21
Haven't seen many lizards on here so I thought I'd introduce you all to Rango!,AnxiousMantisShrimp,https://i.redd.it/lsbzrjs7x9p41.jpg ,F,0,2020-03-28 00:18:52
When your dog does your homework instead of eating it,currytingz,https://i.redd.it/hx0r3z78x9p41.jpg ,F,0,2020-03-28 00:18:51
Blue has more zest for life in one paw than some people do in their entire lives,Siggyk1992,https://i.redd.it/xs39w8e3x9p41.jpg ,F,0,2020-03-28 00:18:12
The sleep is deep,OlympianFlowers,https://i.redd.it/h4mt3ye0x9p41.jpg ,F,0,2020-03-28 00:17:38
Sugar is my stay at home cat!,TheTaroMaster,https://i.redd.it/z9ri2inuw9p41.jpg ,F,0,2020-03-28 00:16:47
She peed all over the table after this,_cecil,https://i.redd.it/u94yhp9pw9p41.jpg ,F,0,2020-03-28 00:15:57
little bean doing a big sleep,Agent-Bmo,https://i.redd.it/apk9t86ow9p41.jpg ,F,0,2020-03-28 00:15:45
I love Turtles,AVikingAndHisPurse,https://i.redd.it/y5gcliwlw9p41.jpg ,F,0,2020-03-28 00:15:23
How I looked when the quarantine began and how I will look when it ends,EmperadorCusco,https://i.redd.it/amh2byklw9p41.jpg ,F,0,2020-03-28 00:15:20
"Can’t even play, he needs all the attention",raacchheell,https://i.redd.it/j9coqrllw9p41.jpg ,F,0,2020-03-28 00:15:20
There is always the one who’s a bit different,SergeantSnickers,https://i.redd.it/zgab30pew9p41.jpg ,F,0,2020-03-28 00:14:16
"My cat Murphy, a rare shot of him not running from me.",AVikingAndHisPurse,https://i.redd.it/7njd35fdw9p41.jpg ,F,0,2020-03-28 00:14:05
My partner went to work. She decided to take his place,piggyglitter,https://i.redd.it/aln13298w9p41.jpg ,F,0,2020-03-28 00:13:29
Dakota turned six and we threw her a quarantine party. Complete with homemade confetti and cake.,mxmc84,https://i.redd.it/n8432vr3w9p41.jpg ,F,0,2020-03-28 00:12:33
Scar in front and Rhett. Waiting for treats.,AVikingAndHisPurse,https://i.redd.it/btyw6ez1w9p41.jpg ,F,0,2020-03-28 00:12:18
My husband pointed out that our corgi has Texas on his snout and now I can’t unsee it,lbeau310,https://i.redd.it/vmwsgxozv9p41.jpg ,F,0,2020-03-28 00:12:04
"My old girl, still loves chasing squirrels.",AVikingAndHisPurse,https://i.redd.it/fkstrkhtv9p41.jpg ,F,0,2020-03-28 00:10:58
Have you ever seen a flying puppy?,federaviolo,https://i.redd.it/zhrv5zaov9p41.jpg ,F,0,2020-03-28 00:10:08
A little in a little out yet she's perfectly comfortable.,joyousjoy23,https://i.redd.it/ublfxepkv9p41.jpg ,F,0,2020-03-28 00:09:40
The upside of this quarantine is that I get to snap all the cute ways my kitty sleeps,ughwalrus,https://i.redd.it/eikf3vmkv9p41.jpg ,F,0,2020-03-28 00:09:36
Model life,Soctress,https://i.redd.it/cgiagizhv9p41.jpg ,F,0,2020-03-28 00:09:18
cutest quarantine coworker,zillessur,https://i.redd.it/6b0r64ngv9p41.jpg ,F,0,2020-03-28 00:08:57
"Momma had 3 babies, sadly 2 passed but remaining baby loves to hug momma",WonderlandsAlyss,https://i.redd.it/dxvbll4gv9p41.jpg ,F,0,2020-03-28 00:08:54
Little one claiming my weighted blanket as her own,UpVotieGirll,https://i.redd.it/qhy3ygtev9p41.jpg ,F,0,2020-03-28 00:08:53
A happy Hades!,polelifeandpussy,https://i.redd.it/jknjswpdv9p41.jpg ,F,0,2020-03-28 00:08:47
Leeloo bored from lockdown,fromETOHtoTHC,https://i.redd.it/d5jiw4qcv9p41.jpg ,F,0,2020-03-28 00:08:23
I think I'll have to ask for my roommates' cat permission before sleeping in my bed.,Flying_Frenchy,https://i.redd.it/6me4jxeav9p41.jpg ,F,0,2020-03-28 00:07:58
Baby deer and goat friends in Arizona,WonderlandsAlyss,https://i.redd.it/d1ys9hv9v9p41.jpg ,F,0,2020-03-28 00:07:56
She knows she did something bad,LautaroRomero,https://i.redd.it/1a87wah6v9p41.png ,F,0,2020-03-28 00:07:32
Chonker nap time,Theflop371,https://i.redd.it/uqkcmo07v9p41.jpg ,F,0,2020-03-28 00:07:29
Cat.,ElAxtrikSol,https://i.redd.it/zm99mpffs9p41.jpg ,F,0,2020-03-27 23:51:57
Remember the kiddo from my last post? This is him now.,Hello_Clark,https://i.redd.it/arymofg1v9p41.jpg ,F,0,2020-03-28 00:06:36
Just sleeping the day away,Chandlerinc1997,https://i.redd.it/x3g401kvu9p41.jpg ,F,0,2020-03-28 00:05:40
The best picture I've ever gotten of her,IanBoiiiiiiii,https://i.redd.it/hiqblxziu9p41.jpg ,F,0,2020-03-28 00:03:45
One week in and I think she feels at home!,teacherskulls,https://i.redd.it/li9u65m7u9p41.jpg ,F,0,2020-03-28 00:02:01
Mood: When you're so done you melt into the couch,lospurritos,https://i.redd.it/16nw06bwt9p41.jpg ,F,0,2020-03-28 00:00:17
Sleeping all your troubles away,SarekTheCat,https://i.redd.it/e65joeeot9p41.jpg ,F,0,2020-03-27 23:59:06
Reddit. Meet shadow,Choppyyy,https://i.redd.it/2t8j6e0ft9p41.jpg ,F,0,2020-03-27 23:57:38
Got this really beautiful pic of my cat the other day,blacked-out-jackle,https://i.redd.it/a2butiuct9p41.jpg ,F,0,2020-03-27 23:57:12
Caption this......,afxjsn,https://i.redd.it/1ccgxvm8t9p41.jpg ,F,0,2020-03-27 23:56:33
He boop the camera!,tm11ex,https://i.redd.it/pein5adys9p41.jpg ,F,0,2020-03-27 23:54:57
"‪I got this little alolan meowth hat a while ago, but decided today was the day I would see what my cat thought! ‬He didn’t seem to mind it at all :)",axezeii,https://i.redd.it/xabt4pbus9p41.jpg ,F,0,2020-03-27 23:54:19
His hooman made him a scarf and he looks very pleased with himself.,missismouse,https://i.redd.it/ylpjrwtqs9p41.jpg ,F,0,2020-03-27 23:53:48
This beautiful duck made his home in my pond,ohboy_why,https://i.redd.it/24s4pr3zr9p41.jpg ,F,0,2020-03-27 23:49:51
This is my one-year-old silver lab Maggie,King_Jackerson,https://i.redd.it/0je6a1jyr9p41.jpg ,F,0,2020-03-27 23:49:20
Proud mother with her babies!,bee_wolf-clqlsm,https://i.redd.it/xs7tqmiyr9p41.jpg ,F,0,2020-03-27 23:49:19
This kiddo is desperately trying to get out,Hello_Clark,https://i.redd.it/u8df2xskr9p41.jpg ,F,0,2020-03-27 23:47:12
"Oh for crying out loud. This barn kitty is never leaving the house again, is he?",sortaitchy,https://i.redd.it/yy2lpbixq9p41.jpg ,F,0,2020-03-27 23:46:27
Working from home is going well,harold_kumar,https://i.redd.it/rfof0phdr9p41.jpg ,F,0,2020-03-27 23:46:04
My 2 dogs Theo (Goldendoodle) and Lucky (Mini Shnouzer) napping under my desk while I work,Saphirage,https://i.redd.it/opge7a90r9p41.jpg ,F,0,2020-03-27 23:44:02
My baby emu,sansyyboyy,https://i.redd.it/hjg04z1zq9p41.jpg ,F,0,2020-03-27 23:43:49
Best dog ever,ShrekTarded,https://i.redd.it/jgtvudn6n9p41.jpg ,F,0,2020-03-27 23:22:33
Keeps checking if I’m still working,karinnza,https://i.redd.it/ql9h6oneq9p41.jpg ,F,0,2020-03-27 23:40:38
"Meanwhile, from the home office....",Twilight_Cee,https://i.redd.it/u9ajox5qn9p41.jpg ,F,0,2020-03-27 23:26:00
Cats That Fell Asleep In The Weirdest Places,reefadamus,https://i.redd.it/5dltbu54q9p41.jpg ,F,0,2020-03-27 23:38:59
"After my dog is finished eating, he grabs a toy and carries it with him to a couch or bed, and bites into it like this while ""hugging"" it for a while, without moving. Why does he do this??",Warmbloodflame,https://i.redd.it/myvq3plsn9p41.jpg ,F,0,2020-03-27 23:36:23
MeowBow,Benoice7,https://i.redd.it/jrfw4c9cp9p41.jpg ,F,0,2020-03-27 23:34:40
My little brother had his two front teef removed and gets to recover in quarantine. It’s adorable [OC],nattyp2theb,https://i.redd.it/upq3j4kbp9p41.jpg ,F,0,2020-03-27 23:34:32
My cat trying to sleep,EpiXxmemer,https://i.redd.it/lxub27k8p9p41.jpg ,F,0,2020-03-27 23:34:06
My boy is tired from all the new playtime at home,Ambstudios,https://i.redd.it/hl7ctqv5p9p41.jpg ,F,0,2020-03-27 23:33:40
Long weekends means time with Benny!,CRLSkyBear,https://i.redd.it/xhn9kywvo9p41.jpg ,F,0,2020-03-27 23:32:07
Found this little guy without his mom.,Awesomelyepicaxolotl,https://i.redd.it/2aqrh7eqo9p41.jpg ,F,0,2020-03-27 23:31:22
"Bruce gets the blanket, I get what’s left",kmwilson02,https://i.redd.it/cdf57z4eo9p41.jpg ,F,0,2020-03-27 23:29:19
Today’s supervisor,OnlyMe369,https://i.redd.it/t3vgrp7co9p41.jpg ,F,0,2020-03-27 23:29:01
She loves that I'm working from home now.,RavennaBlack,https://i.redd.it/kj5w7dj8o9p41.jpg ,F,0,2020-03-27 23:28:34
Grumpy airplane ears,Alarmed_Boot,https://i.redd.it/kssu1i82o9p41.jpg ,F,0,2020-03-27 23:27:56
"Aww, Social Distancing At Its Best",AlfieSp00ner123,https://i.redd.it/ffnaq6cc67p41.jpg ,F,0,2020-03-27 23:27:40
"Meet Groot. Groot likes sticks, but mostly naps.",ninenickel,https://i.redd.it/vwjekyjsn9p41.jpg ,F,0,2020-03-27 23:27:31
Ulysses got a haircut today.,ArTooDeeTooTattoo,https://i.redd.it/8i3shra2o9p41.jpg ,F,0,2020-03-27 23:27:29
Nothing Like A Spa Day!,Mira-Stella,https://i.redd.it/xzjimrdyn9p41.jpg ,F,0,2020-03-27 23:26:54
Finally they are starting to get along!,MyNameIsElaborate,https://i.redd.it/ubp38mzon9p41.jpg ,F,0,2020-03-27 23:25:26
He has a lot of greetings,YigitAras,https://i.redd.it/30qve9bbn9p41.png ,F,0,2020-03-27 23:23:27
Animal is most important site in home,Robert-B-Valdez,https://i.redd.it/21w1dp86n9p41.jpg ,F,0,2020-03-27 23:23:27
Hello! Wanna pet my belly? I promise I don't bite *much*.,mghemm437,https://i.redd.it/7snjg1j1n9p41.jpg ,F,0,2020-03-27 23:21:51
"I met this cutie around the ancient temples in Bagan, Myanmar.",burke013,https://i.redd.it/nu55mausm9p41.jpg ,F,0,2020-03-27 23:21:24
My cat enjoying spring!,YUMMYYUMMY42069,https://i.redd.it/qkv2rexym9p41.jpg ,F,0,2020-03-27 23:21:22
This is Arlo,Arrow191,https://i.redd.it/wzse68tvm9p41.jpg ,F,0,2020-03-27 23:20:55
I took another picture of my dog hope you guys like it,bigboyjourts,https://i.redd.it/b6eec8dum9p41.jpg ,F,0,2020-03-27 23:20:50
My dad built Pesto a house so he too can stay home,deeepestsleeep,https://i.redd.it/d0g1m4mum9p41.jpg ,F,0,2020-03-27 23:20:41
Afternoon naps without a care in the world,mewmw,https://i.redd.it/278fr08pm9p41.jpg ,F,0,2020-03-27 23:19:52
Cleopatra by RedditPulse,RedditPulse,https://i.redd.it/umrkwtumm9p41.jpg ,F,0,2020-03-27 23:19:49
Omnomnomnom,Ngunya,https://i.redd.it/nm5pcwenm9p41.gif ,F,0,2020-03-27 23:19:42
Ferra and her furbrother Jackie,Plumbbookknurd,https://i.redd.it/74i8hr0hm9p41.jpg ,F,0,2020-03-27 23:18:37
I'm not sure if Boris is alright. Probably misses being alone.,kekskerl,https://i.redd.it/tzl468e1m9p41.jpg ,F,0,2020-03-27 23:16:09
Disney+ & Chill,IAMTHEJOEY,https://i.redd.it/clwxz76wl9p41.jpg ,F,0,2020-03-27 23:15:22
Staying home means quality cuddle time,PatienceG96,https://i.redd.it/gl9ax29bl9p41.jpg ,F,0,2020-03-27 23:12:04
"Cat is not ok, he must stay on bed today",erdnA_why,https://i.redd.it/w4olcys5l9p41.jpg ,F,0,2020-03-27 23:11:14
This was his reaction when someone decided to adopt him,rhoskir12,https://i.redd.it/jny983p2l9p41.jpg ,F,0,2020-03-27 23:10:44
She knows how to quarantine and chill.,Sl0m0,https://i.redd.it/3w9u16i7k9p41.jpg ,F,0,2020-03-27 23:05:54
We've learned to stop and smell the roses. But do not eat the roses.,shara_sl,https://i.redd.it/xa4vpic6k9p41.jpg ,F,0,2020-03-27 23:05:49
Ball is life.,MsHannahsVeCan,https://i.redd.it/4316s0d6k9p41.jpg ,F,0,2020-03-27 23:05:46
Someone is sure happy that I’m home today :-),ajones597,https://i.redd.it/3vaw7fi5k9p41.jpg ,F,0,2020-03-27 23:05:40
He saw a good boi,goblinph,https://i.redd.it/o66iydvoj9p41.jpg ,F,0,2020-03-27 23:05:08
Keeping her paws warm,tapoot,https://i.redd.it/9dlkaoy1k9p41.jpg ,F,0,2020-03-27 23:05:02
trusted warden,antibioteka,https://i.redd.it/87nblgbvh8p41.jpg ,F,0,2020-03-27 23:04:12
Chonky Hamster,Toast_702,https://i.redd.it/t2vkqk9rj9p41.jpg ,F,0,2020-03-27 23:03:21
The way Cuca looks at me <3,MUERTOCONFIRMDO,https://i.redd.it/zm878v5gj9p41.jpg ,F,0,2020-03-27 23:01:37
The sweetest doggo there ever was,Opeth-Ethereal,https://i.redd.it/hj021gqbj9p41.jpg ,F,0,2020-03-27 23:00:56
I swear he has normal length legs.,Bobatea,https://i.redd.it/5b6dqvlbj9p41.jpg ,F,0,2020-03-27 23:00:56
When you wore it better than Kylie,teaguexolive,https://i.redd.it/ne5pyz79j9p41.jpg ,F,0,2020-03-27 23:00:34
We got new puppies today!,Natedog1219,https://i.redd.it/svlp83k5j9p41.jpg ,F,0,2020-03-27 23:00:00
It’s my cake day so here’s Lucy!,Ihasapuppy,https://i.redd.it/fbi5yu7ri9p41.jpg ,F,0,2020-03-27 22:57:45
My mom has been buying me all sorts of new things online since she’s been home all the time...this quarantine thing is pretty cool.,ICANHAZLOWERCASE,https://i.redd.it/j4dyu75qi9p41.jpg ,F,0,2020-03-27 22:57:35
My pupper boi,Reaper650,https://i.redd.it/j29upjzei9p41.jpg ,F,0,2020-03-27 22:55:52
Gunther enjoying the snow,trinqunity,https://i.redd.it/cak8ci3bi9p41.jpg ,F,0,2020-03-27 22:55:15
"Cats, just cats",Andrewsreddit914,https://i.redd.it/qwzj2956i9p41.jpg ,F,0,2020-03-27 22:54:27
My little angel,Nathsies,https://i.redd.it/hm9tjsdyh9p41.jpg ,F,0,2020-03-27 22:53:18
"Quarantine discovery, my cats have a cuddle every day. Today it’s heart shaped!",kara_zor-el,https://i.redd.it/0xju1ccwh9p41.jpg ,F,0,2020-03-27 22:53:00
Essential worker reporting for duty: Siberian Husky edition,ivytheblindhusky,https://i.redd.it/tofep5rth9p41.jpg ,F,0,2020-03-27 22:52:58
Dr. Griffin will be your Pawfessor for the rest of the semester,thefrozenfew,https://i.redd.it/2ozaqkgwh9p41.jpg ,F,0,2020-03-27 22:52:58
Sleepy boy,oscarboiiii12,https://i.redd.it/hsa5hdcqh9p41.jpg ,F,0,2020-03-27 22:51:59
"One of the perks of going sharsies on a blanket? Unseen, secret butt scratches.",CaptainMcFiend,https://i.redd.it/17wo6vgph9p41.jpg ,F,0,2020-03-27 22:51:53
Lola being cute,carbonatedlenny,https://i.redd.it/ae3x721oh9p41.jpg ,F,0,2020-03-27 22:51:39
I just decided to post this because she just loved her own little pillow fort,cat_flav0red,https://i.redd.it/jdta8uzkh9p41.jpg ,F,0,2020-03-27 22:51:13
When you are staying Home (StayAtHome),Meddy7700,https://i.redd.it/c4hb0sr8h9p41.jpg ,F,0,2020-03-27 22:50:22
"My husband texted me this from the other room saying, ""I think she needs professional help.""",englishteachernerd,https://i.redd.it/wy04immfh9p41.jpg ,F,0,2020-03-27 22:50:19
Our golden boy had a little too much grub,2xxChromosome,https://i.redd.it/a43i79vch9p41.jpg ,F,0,2020-03-27 22:49:56
Well I guess it’s her bed now,EleCre3p,https://i.redd.it/k6ga6qa6h9p41.jpg ,F,0,2020-03-27 22:48:55
Two old ladies,scottr4053,https://i.redd.it/bt6iu0r2h9p41.jpg ,F,0,2020-03-27 22:48:20
And the way she might look at you,InGenAche,https://i.redd.it/krxjwxv1h9p41.jpg ,F,0,2020-03-27 22:48:11
hi nice to meet you,KrisKeeling,https://i.redd.it/cwl3moq0h9p41.jpg ,F,0,2020-03-27 22:48:07
Cat fell asleep next to me,DanerIn,https://i.redd.it/b4pzflmjg9p41.jpg ,F,0,2020-03-27 22:45:21
Went for a walk with this little poser,CM_MrVsOp,https://i.redd.it/g5ev2k1gg9p41.png ,F,0,2020-03-27 22:45:06
Oliver enjoying his carrot,TcTheHacker,https://i.redd.it/3hfangufg9p41.jpg ,F,0,2020-03-27 22:45:00
Freddie says hi!!! We hope everyone is doing well!!! Stay safe out there,Etcarter5,https://i.redd.it/ro3mg9zvf9p41.jpg ,F,0,2020-03-27 22:41:40
Sleep paralysis...,hongducwb,https://i.redd.it/dzlszffge9p41.jpg ,F,0,2020-03-27 22:41:08
Getting her hooves under her for the first time,Lucas23v,https://i.redd.it/o4j6b5dlf9p41.jpg ,F,0,2020-03-27 22:40:44
"He always jumps into the tub after a shower. Reddit, meet Lou.",CarmelaLangford,https://i.redd.it/90sjbohif9p41.jpg ,F,0,2020-03-27 22:39:43
A proud baby piglet,FAPMANPRODUCTIONS,https://i.redd.it/onmpiig9f9p41.jpg ,F,0,2020-03-27 22:39:17
It wasn't me...,DogsReadingBooks,https://i.redd.it/qnd65pkcf9p41.png ,F,0,2020-03-27 22:38:39
Saffron enjoys the sun,Rementoire,https://i.redd.it/grics469f9p41.jpg ,F,0,2020-03-27 22:38:24
we’re sisters! marley and charlie!,iphonehaslowstorage,https://i.redd.it/tffaq7t8f9p41.jpg ,F,0,2020-03-27 22:38:04
My pup keeping me company during my recovery from minor surgery. I love this dog.,blahblahblah1992,https://i.redd.it/mu8jwqf8f9p41.jpg ,F,0,2020-03-27 22:38:01
My boy Chewy.,CommanderHerps,https://i.redd.it/dv4tx677f9p41.jpg ,F,0,2020-03-27 22:37:48
Mother and daughter,luceratops,https://i.redd.it/9jflkgwte9p41.jpg ,F,0,2020-03-27 22:36:55
It’s afternoon nap time,thisguyonreddit999,https://i.redd.it/irw5fz2ve9p41.jpg ,F,0,2020-03-27 22:35:57
